file,emotion,text,speaker
Ses02F_script02_2_M020,neu,"yeah, of course, i see it now. you want this to be like that other time, right? that's it, right?",Ses02M
Ses02F_script02_2_M021,neu,"okay, yeah, sure, i see it now. listen, you wanna dance?",Ses02M
Ses02F_script02_2_M022,neu,you want me to go get some champagne?,Ses02M
Ses02F_script02_2_M023,neu,take off our shoes?,Ses02M
Ses02F_script02_2_M024,fru,"well, what? you want me to breathe in your ear?",Ses02M
Ses02F_script02_2_M025,fru,you wanna get married again?,Ses02M
Ses02F_script02_2_M026,fru,what? what? you want a divorce?,Ses02M
Ses02F_script02_2_M027,fru,a vacation?,Ses02M
Ses02F_script02_2_M028,fru,"a new carpet? a poodle? ice cream? back rub? a suicide pact? what? what? carla, what the hell do you want?",Ses02M
Ses02F_script02_2_M029,ang,"well, welcome to the human race. do you think this is what i had in mind when i proposed? that four years down the road, we'd be at the beach yelling at each other over fish?",Ses02M
Ses02F_script02_2_M030,xxx,"no. you think i knew that there'd be times when you'd look at me like a used kleenex? or that i'd look at you and think, holy hell, when's the next flight to alaska?",Ses02M
Ses02F_script02_2_M031,sad,"no, carla, i'm just like you. i thought it was gonna be all peaches and roses and sand in our toes and wind in our hair and the fish will always come and the bills will pay themselves and we'll have three fat rosy kids and ha, ha, baby, the joke's on us",Ses02M
Ses02F_script02_2_M032,fru,"'cause you know what you get, carla? you know what you get? this.",Ses02M
Ses02F_script02_2_M033,neu,"yes, it is.",Ses02M
Ses02F_script02_2_M034,neu,right.,Ses02M
Ses02F_script02_2_M035,sad,"i know, me neither.",Ses02M
Ses02F_script02_2_M036,sad,i'm doing the best i can.,Ses02M
Ses02F_script02_2_M037,sad,maybe if you were with somebody else too.,Ses02M
Ses02F_script02_2_M038,sad,"no, i know. but still. i know i don't make you happy.",Ses02M
Ses02F_script02_2_M039,sur,yeah?,Ses02M
Ses02F_script02_2_M040,xxx,"well, now that you mention it. no, i don't.",Ses02M
Ses02F_script02_2_M041,hap,"i don't know. it seemed like a pretty good spot to me. i mean, look at the view you have of the moon from here.",Ses02M
Ses02F_script02_2_M042,hap,"well, look what we have here.",Ses02M
Ses02F_script02_2_M043,hap,it's not champagne.,Ses02M
Ses02F_script02_2_M044,xxx,you still cold? do you wanna go home?,Ses02M
Ses02F_script02_2_M045,hap,shh. if we're very quiet the fish might come.,Ses02M
Ses02F_script02_2_M046,hap,or not.,Ses02M
Ses02F_script03_1_F000,fea,do you think it's them?,Ses02F
Ses02F_script03_1_F001,fea,"well, nobody know we're here except freda and she wouldn't ring up.",Ses02F
Ses02F_script03_1_F002,fea,what're we gonna do?,Ses02F
Ses02F_script03_1_F003,xxx,"now and always, sweet.",Ses02F
Ses02F_script03_1_F004,xxx,it was bound to come sooner or later.,Ses02F
Ses02F_script03_1_F005,hap,"ah, it send shivers up my spine.",Ses02F
Ses02F_script03_1_F006,hap,behave exquisitely.,Ses02F
Ses02F_script03_1_F007,hap,"oh, of course. i shall probably do a court curtsy.",Ses02F
Ses02F_script03_1_F008,hap,what's so horrible is that one can't stay happy.,Ses02F
Ses02F_script03_1_F009,hap,it's true. the whole business is a very poor joke.,Ses02F
Ses02F_script03_1_F010,hap,"yes, meaning just that.",Ses02F
Ses02F_script03_1_F011,xxx,don't laugh at me. i'm serious.,Ses02F
Ses02F_script03_1_F012,neu,who's they?,Ses02F
Ses02F_script03_1_F013,neu,"if i laugh at everything, then i must laugh at us too.",Ses02F
Ses02F_script03_1_F014,neu,"well how long will it last us, this ludicrous overbearing love of ours.",Ses02F
Ses02F_script03_1_F015,neu,"well, shall we always want to bicker and fight?",Ses02F
Ses02F_script03_1_F016,neu,"oh, dear, shall we like that?",Ses02F
Ses02F_script03_1_F017,neu,"well, what happens if one of us dies? i mean, does the one that's left still laugh?",Ses02F
Ses02F_script03_1_F018,xxx,"that's serious enough, isn't it?",Ses02F
Ses02F_script03_1_F019,hap,"darling, i believe you're talking nonsense.",Ses02F
Ses02F_script03_1_F020,hap,"elliott, worms don't pop.",Ses02F
Ses02F_script03_1_F021,hap,"oh, thank you, dear. the same applies to you except that if i catch so much as looking at another woman, i'll kill you.",Ses02F
Ses02F_script03_1_F022,hap,which particular one?,Ses02F
Ses02F_script03_1_F023,hap,charles. that was his name. charles. he did wriggle so beautifully.,Ses02F
Ses02F_script03_1_F024,hap,"yes, i know you did. you threw it out of the window into the grand canal. i don't think i'll ever forgive you for that.",Ses02F
Ses02F_script03_1_F025,hap,it went in intermittently for days.,Ses02F
Ses02F_script03_1_F026,hap,it burned my comb too and all the towels in the bathroom.,Ses02F
Ses02F_script03_1_F027,neu,that was the first time you ever hit me.,Ses02F
Ses02F_script03_1_F028,hap,"the manager came in and found us rolling around on the floor, biting and scratching like panthers.",Ses02F
Ses02F_script03_1_F029,hap,it was ridiculous. completely ridiculous.,Ses02F
Ses02F_script03_1_F030,xxx,and very much sillier.,Ses02F
Ses02F_script03_1_M000,xxx,good god.,Ses02M
Ses02F_script03_1_M001,neu,i wonder.,Ses02M
Ses02F_script03_1_M002,xxx,"must be them, then.",Ses02M
Ses02F_script03_1_M003,xxx,"we're all right, darling, aren't we? whatever happens.",Ses02M
Ses02F_script03_1_M004,neu,i don't care then.,Ses02M
Ses02F_script03_1_M005,neu,hello? hello? what? wrong number.,Ses02M
Ses02F_script03_1_M006,xxx,what do we do if they suddenly walk in on us?,Ses02M
Ses02F_script03_1_M007,neu,with the most perfect poise?,Ses02M
Ses02F_script03_1_M008,neu,things that ought to matter dreadfully don't matter at all when one's happy. do they?,Ses02M
Ses02F_script03_1_M009,neu,"oh, darling, don't say that.",Ses02M
Ses02F_script03_1_M010,neu,"meaning that sacred and beautiful thing, love?",Ses02M
Ses02F_script03_1_M011,xxx,"oh, what does it all mean? that's what i ask myself in my ceaseless quest for ultimate truth. dear god, what does it all mean?",Ses02M
Ses02F_script03_1_M012,neu,"you mustn't be serious, my dear one. that's just what they want.",Ses02M
Ses02F_script03_1_M013,neu,all those futile moralists that try to make life unbearable. laugh at them. be flippant. laugh at everything. all their sacred shibboleths.,Ses02M
Ses02F_script03_1_M014,neu,flippancy brings out the acid in their damn sweetness and light.,Ses02M
Ses02F_script03_1_M015,neu,"certainly, you must. we're figures of fun, alright.",Ses02M
Ses02F_script03_1_M016,neu,who knows.,Ses02M
Ses02F_script03_1_M017,neu,"no, that desire will fade. along with our passion.",Ses02M
Ses02F_script03_1_M018,neu,depends on how well we've played.,Ses02M
Ses02F_script03_1_M019,hap,yes. yes. with all his might.,Ses02M
Ses02F_script03_1_M020,hap,"no. no, it isn't. death is very laughable. such a cunning little mystery. all done with mirrors.",Ses02M
Ses02F_script03_1_M021,neu,so is everyone else in the long run.,Ses02M
Ses02F_script03_1_M022,hap,"let's be superficial and pity the poor philosophers. let's blow our trumpets and squeakers and enjoy the party as much as we can. like quite idiotic, very small school children. let's savor the delight of the moment.",Ses02M
Ses02F_script03_1_M023,hap,"come and kiss me, darling, before your body rots and worms pop in and out of your eye sockets.",Ses02M
Ses02F_script03_1_M024,neu,"i don't care what you do. see, you could paint yourself green and dance naked in the place vendome and rush off madly with all the men in the world and i shan't say a word. as long as you love me best.",Ses02M
Ses02F_script03_1_M025,neu,you remember that awful scene we had in venice?,Ses02M
Ses02F_script03_1_M026,neu,the one when you bought that little painted wooden snake in the piazza and put it on my bed.,Ses02M
Ses02F_script03_1_M027,xxx,"ah, horrible thing. i hated it.",Ses02M
Ses02F_script03_1_M028,neu,how long did that row last?,Ses02M
Ses02F_script03_1_M029,neu,the worst one was in cannes when your curling iron burnt a hole in my new dressing gown.,Ses02M
Ses02F_script03_1_M030,xxx,"that was a rouser, wasn't it?",Ses02M
Ses02F_script03_1_M031,neu,i didn't hit you very hard.,Ses02M
Ses02F_script03_1_M032,hap,"oh, i'll never forget his face.",Ses02M
Ses02F_script03_1_M033,neu,we were very much younger then.,Ses02M
Ses02F_script03_1_M034,neu,"as a matter of fact, the real cause of that row was peter burden.",Ses02M
Ses02F_script03_2_F000,xxx,"honey, you knew there was nothing in that.",Ses02F
Ses02F_script03_2_F001,xxx,presents? just a trivial little broach.,Ses02F
Ses02F_script03_2_F002,xxx,"no, it wasn't. it was very pretty. i still have it and i wear it often.",Ses02F
Ses02F_script03_2_F003,xxx,"no, i didn't. you worked the whole thing up in your jealous imagination.",Ses02F
Ses02F_script03_2_F004,xxx,"just a little perhaps, nothing serious.",Ses02F
Ses02F_script03_2_F005,xxx,"well, what of it?",Ses02F
Ses02F_script03_2_F006,xxx,it didn't hurt him at all and i enjoyed it.,Ses02F
Ses02F_script03_2_F007,neu,"well, if you hadn't been so suspicious and nosey, you never would have known a thing about it.",Ses02F
Ses02F_script03_2_F008,xxx,i'm bored with this conversation.,Ses02F
Ses02F_script03_2_F009,xxx,"no, thanks.",Ses02F
Ses02F_script03_2_F010,xxx,don't see why you want any. you've already had two glasses.,Ses02F
Ses02F_script03_2_F011,neu,just seems so silly to go on and on and on with such a thing.,Ses02F
Ses02F_script03_2_F012,neu,"well, it's become a habit with you.",Ses02F
Ses02F_script03_2_F013,ang,don't be so stupid.,Ses02F
Ses02F_script03_2_F014,ang,what?,Ses02F
Ses02F_script03_2_F015,xxx,"no, just making myself fascinating for you.",Ses02F
Ses02F_script03_2_F016,hap,"a woman's job is to allure the man. watch me a minute, will you?",Ses02F
Ses02F_script03_2_F017,fru,"no, it isn't.",Ses02F
Ses02F_script03_2_F018,ang,"oh, be quiet.",Ses02F
Ses02F_script03_2_F019,fru,doesn't seem to have worked such wonders with you.,Ses02F
Ses02F_script03_2_F020,ang,"adders don't snap, they sting.",Ses02F
Ses02F_script03_2_F021,xxx,they sting.,Ses02F
Ses02F_script03_2_F022,fru,"i don't care, do you understand? i don't care. i don't care if they bark or roll about like hoops.",Ses02F
Ses02F_script03_2_F023,xxx,"yes, i did. quite a lot.",Ses02F
Ses02F_script03_2_F024,fru,mind your own business.,Ses02F
Ses02F_script03_2_F025,ang,you're quite insufferable,Ses02F
Ses02F_script03_2_F026,fru,i expect it's because you're drunk.,Ses02F
Ses02F_script03_2_F027,xxx,you've always had a weak head.,Ses02F
Ses02F_script03_2_F028,fru,"on the contrary, a child of two could get violently drunk on only one glass of brandy.",Ses02F
Ses02F_script03_2_F029,ang,shut up.,Ses02F
Ses02F_script03_2_F030,fru,"not very funny, dear. you'd better have some more brandy.",Ses02F
Ses02F_script03_2_F031,ang,why?,Ses02F
Ses02F_script03_2_F032,fru,there aren't any people upstairs. it's a photographer's studio.,Ses02F
Ses02F_script03_2_F033,xxx,they're away in tunis.,Ses02F
Ses02F_script03_2_F034,ang,"turn it on again, please.",Ses02F
Ses02F_script03_2_F035,ang,"very well, if you insist on being boorish and idiotic.",Ses02F
Ses02F_script03_2_F036,ang,you are far too temperamental. try to control yourself.,Ses02F
Ses02F_script03_2_F037,ang,stop it. go away. i hate you.,Ses02F
Ses02F_script03_2_F038,ang,"listen? listen, indeed. i am sick and tired of listening to you, damn sadistic bully.",Ses02F
Ses02F_script03_2_F039,ang,"i hate you. stop it. stop it. i hate you, do you hear? you're conceited and overbearing and utterly impossible.",Ses02F
Ses02F_script03_2_F040,ang,this is the end. finally and forever. do you hear me? the end.,Ses02F
Ses02F_script03_2_F041,ang,"oh yes, i am.",Ses02F
Ses02F_script03_2_F042,ang,i am. let go of me. you're a cruel fiend and i hate and loathe you.,Ses02F
Ses02F_script03_2_F043,ang,thank god i realized what you are-- i'd never marry you again ever in my life. you're a cruel fiend and i hate you. you're a beast. you're a beast--i hate you. stop it. stop it.,Ses02F
Ses02F_script03_2_M000,neu,"as a matter of fact, the real cause of that row was peter burden.",Ses02M
Ses02F_script03_2_M001,neu,i knew nothing of the sort. you took presents from him.,Ses02M
Ses02F_script03_2_M002,xxx,"ah, yes, i remember it well. bristling with diamonds in the worst possible taste.",Ses02M
Ses02F_script03_2_M003,xxx,you went out of your way to torture me over peter burden.,Ses02M
Ses02F_script03_2_M004,xxx,"you must admit, he was in love with you, wasn't he?",Ses02M
Ses02F_script03_2_M005,xxx,you let him kiss you. you said you did.,Ses02M
Ses02F_script03_2_M006,ang,what of it?,Ses02M
Ses02F_script03_2_M007,ang,"well, what about me?",Ses02M
Ses02F_script03_2_M008,xxx,"well, that's a nice point of view i must say.",Ses02M
Ses02F_script03_2_M009,neu,"me, too. bored stiff. you want some brandy?",Ses02M
Ses02F_script03_2_M010,xxx,i think i'll have some.,Ses02M
Ses02F_script03_2_M011,neu,no particular reason. anyhow they were very small ones.,Ses02M
Ses02F_script03_2_M012,fru,you can hardly call three liquor glasses in a whole evening going on and on and on.,Ses02M
Ses02F_script03_2_M013,ang,"you needn't be so grand, just because you don't happen to want any yourself at the moment.",Ses02M
Ses02F_script03_2_M014,xxx,"really, amanda.",Ses02M
Ses02F_script03_2_M015,fru,nothing.,Ses02M
Ses02F_script03_2_M016,xxx,going out somewhere dear?,Ses02M
Ses02F_script03_2_M017,xxx,that reply has broken my heart.,Ses02M
Ses02F_script03_2_M018,xxx,"as a matter of fact, that's perfectly true.",Ses02M
Ses02F_script03_2_M019,fru,"yes, it is.",Ses02M
Ses02F_script03_2_M020,xxx,"ah, it's a pity you didn't have any more brandy. it might have made you a little less disagreeable.",Ses02M
Ses02F_script03_2_M021,fru,"snap, snap, snap, like a little adder.",Ses02M
Ses02F_script03_2_M022,fru,nonsense. they have a little bag of venom behind their fangs and they snap.,Ses02M
Ses02F_script03_2_M023,fru,they snap.,Ses02M
Ses02F_script03_2_M024,xxx,did you see much of peter burden after our divorce?,Ses02M
Ses02F_script03_2_M025,xxx,"hmm, i imagine you let him kiss you a good deal more then.",Ses02M
Ses02F_script03_2_M026,xxx,"oh, must have had a riotous time. no restraint at all. very enjoyable and never had much anyhow.",Ses02M
Ses02F_script03_2_M027,ang,i'm not in the least drunk.,Ses02M
Ses02F_script03_2_M028,fru,"as i mentioned before, i have had three minute liquor glasses of brandy the whole evening long. a child of two couldn't get drunk on that.",Ses02M
Ses02F_script03_2_M029,fru,"oh, very interesting. how about a child of four? a child of six? or a child of nine?",Ses02M
Ses02F_script03_2_M030,ang,"we could get a good debate going about this, don't you think? intemperate tots.",Ses02M
Ses02F_script03_2_M031,xxx,all right. i will.,Ses02M
Ses02F_script03_2_M032,xxx,"you better turn that off, i think.",Ses02M
Ses02F_script03_2_M033,fru,because it's late and it'll annoy the people upstairs.,Ses02M
Ses02F_script03_2_M034,fru,there are people downstairs i suppose?,Ses02M
Ses02F_script03_2_M035,fru,this is no time of the year for tunis.,Ses02M
Ses02F_script03_2_M036,ang,i'll do no such thing.,Ses02M
Ses02F_script03_2_M037,ang,turn it off. it's driving me mad.,Ses02M
Ses02F_script03_2_M038,ang,turn it off.,Ses02M
Ses02F_script03_2_M039,ang,"amanda, listen. listen",Ses02M
Ses02F_script03_2_M040,fru,"very amusing, indeed.",Ses02M
Ses02F_script03_2_M041,ang,"you're a vile, tempered, loose living, wicked little beast and i hope to never see you again as long as i live.",Ses02M
Ses02F_script03_2_M042,ang,you're not going like this.,Ses02M
Ses02F_script03_2_M043,ang,you're not.,Ses02M
Ses02F_script03_2_M044,ang,shut up. shut up.,Ses02M
Ses02F_script03_2_M045,ang,i wouldn't-- i wouldn't marry--,Ses02M
Ses02F_script03_2_M046,ang,i wouldn't marry you if you came in crawling on your knees,Ses02M
Ses02F_script03_2_M047,ang,you're a evil vampire and i hope to god i never see you again as long as i live.,Ses02M
Ses02M_impro01_F000,neu,"hi, how can i help you?",Ses02F
Ses02M_impro01_F001,neu,"sure, um",Ses02F
Ses02M_impro01_F002,neu,do you have two forms of id with you?,Ses02F
Ses02M_impro01_F003,neu,"i actually need two forms of id. i need either a passport or a birth certificate, or social security card. i'm sorry.",Ses02F
Ses02M_impro01_F004,neu,well,Ses02F
Ses02M_impro01_F005,neu,i- i can take your driver's license but i need another form of id in order to process this paper work.,Ses02F
Ses02M_impro01_F006,neu,"um, that you would need to go home and get another form of id and come back.",Ses02F
Ses02M_impro01_F007,fru,"well, i'm sorry sir but",Ses02F
Ses02M_impro01_F008,fru,you need to bring two forms of id there is nothing we can do about it.,Ses02F
Ses02M_impro01_F009,fru,"well, it's actually-",Ses02F
Ses02M_impro01_F010,fru,"it's standard that you bring a couple of forms of id, i'm sorry.",Ses02F
Ses02M_impro01_F011,fru,"well, i'm sorry, sir, but we're not responsible.",Ses02F
Ses02M_impro01_F012,fru,"yes, you did, thank you very much, but we're not responsible if you've forgotten something, and we need to have two forms of id.",Ses02F
Ses02M_impro01_F013,fru,"i'm sorry, but there is a lot of people waiting so you're just going to have to get in line again.",Ses02F
Ses02M_impro01_F014,fru,"it just happens to people all the time, i'm sorry sir, but i can't make an exception for you.",Ses02F
Ses02M_impro01_F015,neu,"i'm sorry, sir.",Ses02F
Ses02M_impro01_F016,neu,there is nothing i can do.,Ses02F
Ses02M_impro01_F017,fru,"i know sir, but we have to have two forms. there is nothing i can do about it, i'm sorry.",Ses02F
Ses02M_impro01_F018,fru,"i'm sorry, sir. there is nothing i can do.",Ses02F
Ses02M_impro01_F019,fru,"well, if you had checked the web site it would have said.",Ses02F
Ses02M_impro01_F020,fru,if you had checked the website it would have said that you needed two forms of identification.,Ses02F
Ses02M_impro01_F021,fru,"well, maybe you should",Ses02F
Ses02M_impro01_F022,fru,right. so maybe you should go home now and get your paperwork and come back.,Ses02F
Ses02M_impro01_F023,fru,"i'm sorry sir but there's a lot of people waiting. so if you won't move out of the way, then i'm going to have to call security.",Ses02F
Ses02M_impro01_F024,fru,"i'm sorry, sir, it's not my choice.",Ses02F
Ses02M_impro01_M000,fru,all right. finally. here you go.,Ses02M
Ses02M_impro01_M001,neu,"yea. i just want to get this done,",Ses02M
Ses02M_impro01_M002,neu,get my new license.,Ses02M
Ses02M_impro01_M003,neu,"um, no, i got my driver's license though.",Ses02M
Ses02M_impro01_M004,neu,"uh, sorry, i forgot them. i mean i've got to -",Ses02M
Ses02M_impro01_M005,neu,well is the dri-driver's license going to work?,Ses02M
Ses02M_impro01_M006,fru,"okay, so what are you saying? what-",Ses02M
Ses02M_impro01_M007,ang,"what? i- you telling me i waited in that huge line to go and sit down and get my number called, like after",Ses02M
Ses02M_impro01_M008,ang,three hours and,Ses02M
Ses02M_impro01_M009,ang,shouldn't they have like told us about that? i mean why - why would they make me go and wait three hours if i have got to go and do it again?,Ses02M
Ses02M_impro01_M010,ang,"it's standard? i mean i don't work at the d.m.v. how am i supposed to know that, like, i stand in line, i get my",Ses02M
Ses02M_impro01_M011,ang,"i filled out the application right, didn't i?",Ses02M
Ses02M_impro01_M012,fru,okay. what about - no -- how about you hold that and i'll - i'll go and i can come back-,Ses02M
Ses02M_impro01_M013,fru,i've been waiting for three hours.,Ses02M
Ses02M_impro01_M014,fru,this is ridiculous. come on,Ses02M
Ses02M_impro01_M015,fru,"i cannot go back in that line. i've got stuff i need to do, i mean-",Ses02M
Ses02M_impro01_M016,xxx,"but my driver's license - i had to have my birth certificate to get my driver's license in the first place right, i mean this - here is my driver's license so",Ses02M
Ses02M_impro01_M017,fru,that doesn't make any sense. why?,Ses02M
Ses02M_impro01_M018,ang,you- shouldn't you have like a sign or something maybe like up on the counter when you get the applica- maybe on the application,Ses02M
Ses02M_impro01_M019,ang,"what web- i didn't go to a website - why would i need to - it's the d.m.v.. you come to the d.m.v., you wait in line for three hours, and then you go home.",Ses02M
Ses02M_impro01_M020,fru,i waited in line now i'm ready to get my stuff and then go home.,Ses02M
Ses02M_impro01_M021,fru,"god, oh my-",Ses02M
Ses02M_impro01_M022,fru,this is ridiculous.,Ses02M
Ses02M_impro02_F000,sad,i don't want you to go.,Ses02F
Ses02M_impro02_F001,sad,"i'm going to miss you too; i don't know what i'm going to do here without you. it's going to be so lonely, and so hard.",Ses02F
Ses02M_impro02_F002,sad,i don't want to be a single mom.,Ses02F
Ses02M_impro02_F003,sad,but,Ses02F
Ses02M_impro02_F004,sad,it's dangerous; i mean how can you make sure that you'll,Ses02F
Ses02M_impro02_F005,sad,i hope so.,Ses02F
Ses02M_impro02_F006,sad,i hope so.,Ses02F
Ses02M_impro02_F007,sad,it's going to be really rough.,Ses02F
Ses02M_impro02_F008,sad,i'll send you lots of pictures.,Ses02F
Ses02M_impro02_F009,sad,"well, just promise me that you going to be safe.",Ses02F
Ses02M_impro02_F010,sad,"i mean can't they put you in like, you know kitchen work or something where you won't get",Ses02F
Ses02M_impro02_F011,fru,it doesn't make any sense; i don't know why we have to be at war in the first place.,Ses02F
Ses02M_impro02_F012,sad,"will you write me letters, paper ones?",Ses02F
Ses02M_impro02_F013,sad,"our baby needs a dad; you can't leave. okay, you can't disappear.",Ses02F
Ses02M_impro02_F014,sad,i'll miss you too.,Ses02F
Ses02M_impro02_M000,sad,"i know, i know. i don't want to go either baby. i love you know. and i'm going to miss you a lot.",Ses02M
Ses02M_impro02_M001,sad,"you won't be. i'll be back; i'll be back before you know it. all right, and",Ses02M
Ses02M_impro02_M002,sad,and,Ses02M
Ses02M_impro02_M003,fru,"it's- it's dangerous anywhere, honey. i mean this is -this- i'm just going to go and we'll get it over with,",Ses02M
Ses02M_impro02_M004,xxx,"i'll come back we'll have, you know, some good benefits from being in the service and then we'll live - we'll live a happy life, then the rest of us, like the three of us.",Ses02M
Ses02M_impro02_M005,xxx,a little family.,Ses02M
Ses02M_impro02_M006,xxx,you gotta,Ses02M
Ses02M_impro02_M007,sad,"you gotta take care of our baby for me, alright?",Ses02M
Ses02M_impro02_M008,sad,"i hope so, because i'm not going to be able to survive without all that. i don't know what i'm going to do.",Ses02M
Ses02M_impro02_M009,sad,i've never been - i've never been away from you for two weeks let alone a year.,Ses02M
Ses02M_impro02_M010,xxx,"no, it doesn't work that way",Ses02M
Ses02M_impro02_M011,xxx,"but, i mean, i'm going to do whatever i can and get back here as fast as i can.",Ses02M
Ses02M_impro02_M012,xxx,"i know, but it's not our decision, i guess, you know, i mean",Ses02M
Ses02M_impro02_M013,sad,there's people that thought it was the right thing to do so now we have to- we have to do what we have to do for our country,Ses02M
Ses02M_impro02_M014,neu,"and it'll work out you know, go there and do that. yeah, i'll be back",Ses02M
Ses02M_impro02_M015,xxx,"yeah, of course. i don't know if we'll have computers or anything like that you know, so probably my only option then.",Ses02M
Ses02M_impro02_M016,xxx,"yeah, i'll write you every day 'cause you're the only thing that's going to be on my mind.",Ses02M
Ses02M_impro02_M017,sad,"our baby has a dad, alright. daddy is going to be back soon.",Ses02M
Ses02M_impro02_M018,sad,"i want you to, you know, take lots of video; pictures and i can see you when i get back or while i'm there. i'm going to miss you.",Ses02M
Ses02M_impro03_F000,hap,what? what? you look really happy what's going on?,Ses02F
Ses02M_impro03_F001,hap,finally did what?,Ses02F
Ses02M_impro03_F002,xxx,"you did? oh, my gosh, i'm so proud of you.",Ses02F
Ses02M_impro03_F003,hap,"oh, my gosh. well, and did",Ses02F
Ses02M_impro03_F004,hap,did she say yes?,Ses02F
Ses02M_impro03_F005,hap,that's like the most definitive.,Ses02F
Ses02M_impro03_F006,xxx,"oh, my gosh, wait so when did you decide to do this, i mean,",Ses02F
Ses02M_impro03_F007,hap,i would have thought you would have told me that you were planning on doing this.,Ses02F
Ses02M_impro03_F008,hap,"yea, i guess so. oh, my gosh. was she surprised?",Ses02F
Ses02M_impro03_F009,xxx,yeah.,Ses02F
Ses02M_impro03_F010,xxx,so what did you do?,Ses02F
Ses02M_impro03_F011,hap,"oh, you did not.",Ses02F
Ses02M_impro03_F012,hap,"oh, my gosh. that's so cute",Ses02F
Ses02M_impro03_F013,hap,"that's so romantic. oh, my gosh. she must have died. that's like one of those things you write into a magazine about like my boyfriend did this. oh my god.",Ses02F
Ses02M_impro03_F014,hap,she must have flipped out.,Ses02F
Ses02M_impro03_F015,hap,right exactly because you can't say no in front of thousands of people. [laughter],Ses02F
Ses02M_impro03_F016,hap,did you bring her up on stage too?,Ses02F
Ses02M_impro03_F017,hap,"oh, my gosh, that's so cute.",Ses02F
Ses02M_impro03_F018,hap,are your parents excited or...?,Ses02F
Ses02M_impro03_F019,xxx,"yea, totally. so when is it going to happen?",Ses02F
Ses02M_impro03_F020,hap,"ooh, that would be fun.",Ses02F
Ses02M_impro03_F021,xxx,"do you think you'll get a house or something, like you guys are looking to buy some place or",Ses02F
Ses02M_impro03_F022,xxx,yeah. [laughter],Ses02F
Ses02M_impro03_F023,hap,"oh my gosh. i cannot believe you're getting married, that is so cool.",Ses02F
Ses02M_impro03_F024,hap,"golly, it just makes me all like romantic inside, like i really want that to happen to me. [laughter]",Ses02F
Ses02M_impro03_F025,xxx,did you have a good ring? you better have had a good ring.,Ses02F
Ses02M_impro03_F026,xxx,good. the ring makes all the difference.,Ses02F
Ses02M_impro03_F027,xxx,"oh, that's awesome.",Ses02F
