file,emotion,text,speaker
Ses04M_impro08_M009,fru,"well i mean, i'm supposed to use discretion in the situation and, um--",Ses04M
Ses04M_impro08_M010,neu,all i can do for you right now is give you a hundred dollars.,Ses04M
Ses04M_impro08_M011,neu,what i can,Ses04M
Ses04M_impro08_M012,neu,what i can do for you is give you a hundred dollars right now and fill out complaint form,Ses04M
Ses04M_impro08_M013,neu,which you- which you'll have to go into a local verizon dealer-- or sprint.,Ses04M
Ses04M_impro08_M014,fru,"ma'am, i understand that.",Ses04M
Ses04M_impro08_M015,fru,"ma'am, i - i - i understand that. i understand that. what i can do for you right now is what i'm telling you is that i can do- i can give you a hundred dollars back and then you'll have to fill out a complaint form and then you'll get -- there'll be some investigation. some men will show up at your house and go through your things.",Ses04M
Ses04M_impro08_M016,fru,and then then you'll get some money back.,Ses04M
Ses04M_impro08_M017,neu,a few weeks. you won't even know that they were there.,Ses04M
Ses04M_impro08_M018,fru,"okay. you know what? i just don't feel like doing this anymore. um, you can have all the money back, two hundred dollar, right now.",Ses04M
Ses04M_impro08_M019,neu,"yeah. that's fine. i just -- that's fine. yeah, i mean, it doesn't make any difference to me. i mean, it's not like it's going to cost my job or anything.",Ses04M
Ses04M_impro08_M020,neu,"i mean, technically, that's policy. but, like, i mean, i don't really care about -- nobody really cares about policy here.",Ses04M
Ses04M_impro08_M021,neu,sure.,Ses04M
Ses04M_impro08_M022,neu,you're welcome.,Ses04M
Ses04M_impro08_M023,neu,"no, no, no, it's cool. it's cool. it's cool. so, um",Ses04M
Ses04M_impro08_M024,neu,"you know, so- i mean, are you doing anything later? or um",Ses04M
Ses04M_impro08_M025,neu,"oh, i don't know. i mean, i don't know. i just thought, you know, maybe you want to get some co--i mean, i'm actually -- wait, where do you live? oh, you're in los angeles, i see. oh, no, that sucks 'cause i'm in, actually in alabama.",Ses04M
Ses04M_impro08_M026,neu,"god, that's like a whole problem with like-- but, no, i mean, hey-- if you ever",Ses04M
Ses04M_impro08_M027,neu,"if you ever come out to montgomery, i mean, you know, just -- just call up, you know, call up the operator and i'll-- i'll be here. so, um.",Ses04M
Ses04M_impro08_M028,neu,alright. take care.,Ses04M
Ses04M_script01_1_F000,neu,what's he going to say? maybe we ought to tell him before he sees it.,Ses04F
Ses04M_script01_1_F001,xxx,how could he see it? i was the first one up. he was still in bed.,Ses04F
Ses04M_script01_1_F002,sur,when?,Ses04F
Ses04M_script01_1_F003,xxx,what was he doing out here at four in the morning?,Ses04F
Ses04M_script01_1_F004,xxx,did you talk to him?,Ses04F
Ses04M_script01_1_F005,xxx,he cried hard?,Ses04F
Ses04M_script01_1_F006,xxx,what was he doing out here at that hour? he's dreaming about him again. he's walking around at night.,Ses04F
Ses04M_script01_1_F007,sad,he's getting just like after he died. what's the meaning in that?,Ses04F
Ses04M_script01_1_F008,sur,what?,Ses04F
Ses04M_script01_1_F009,fru,"what do you mean, dishonest?",Ses04F
Ses04M_script01_1_F010,fru,what do you want to do? argue with him?,Ses04F
Ses04M_script01_1_F011,ang,you can't say that to him.,Ses04F
Ses04M_script01_1_F012,ang,how are you going to prove it? can you prove it?,Ses04F
Ses04M_script01_1_F013,ang,"to you it is and to me, but not to him. you can talk yourself blue in the face, but there's no body and no grave, so where are you?",Ses04F
Ses04M_script01_1_F014,xxx,"the trouble is the goddamn newspapers. every month some boy turns up from nowhere, so the next boy is going to be larry. so we have to keep--",Ses04F
Ses04M_script01_1_F015,neu,why?,Ses04F
Ses04M_script01_1_F016,xxx,"well i've got an idea, but what's the story?",Ses04F
Ses04M_script01_1_F017,neu,"well that's only your business, chris.",Ses04F
Ses04M_script01_1_F018,ang,what do you want me to do? you're old enough to know your own mind.,Ses04F
Ses04M_script01_1_F019,neu,well you want to make sure your father isn't going to have --,Ses04F
Ses04M_script01_1_F020,fru,i'm just saying.,Ses04F
Ses04M_script01_1_F021,ang,i ignore what i got to ignore. the girl is larry's girl.,Ses04F
Ses04M_script01_1_F022,ang,"from father's point of view, he's not dead. and you have no right to take his girl.",Ses04F
Ses04M_script01_1_F023,fru,"now you can go on from there if you know where to go. but i'm telling you i don't know where to go. see, i don't know.",Ses04F
Ses04M_script01_1_F024,fru,now what can i do for you?,Ses04F
Ses04M_script01_1_F025,xxx,you're a considerate fellow. there's nothing wrong in that.,Ses04F
Ses04M_script01_1_F026,xxx,did you ask annie yet?,Ses04F
Ses04M_script01_1_F027,neu,how do you know she'll marry you? maybe she feels the same way father does.,Ses04F
Ses04M_script01_1_F028,neu,"the trouble is, you don't see enough women. you never did.",Ses04F
Ses04M_script01_1_F029,ang,i don't see why it has to be annie.,Ses04F
Ses04M_script01_1_F030,xxx,"well that's a good answer, but it don't answer anything. he thinks he's coming back, chris. you marry that girl, you're pronouncing him dead. now what happens to your father? do you know? because i don't.",Ses04F
Ses04M_script01_1_F031,fru,"alright, then, mom.",Ses04F
Ses04M_script01_1_F032,neu,yes we did. do you want to keep going?,Ses04F
Ses04M_script01_1_F033,neu,just give it some more thought.,Ses04F
Ses04M_script01_1_F034,ang,what the hell is this?,Ses04F
Ses04M_script01_1_F035,ang,are you crazy?,Ses04F
Ses04M_script01_1_F036,ang,you've got a business here. what the hell is this?,Ses04F
Ses04M_script01_1_F037,ang,must you be inspired?,Ses04F
Ses04M_script01_1_F038,xxx,you mean -- tell me something. you mean you'd really leave the business?,Ses04F
Ses04M_script01_1_F039,ang,you don't want to think like that.,Ses04F
Ses04M_script01_1_F040,ang,"alright. but just don't think like that because what the hell did we work for? that's all for you, chris. the whole shooting match is just for you.",Ses04F
Ses04M_script01_1_F041,ang,"but don't think that way, you hear me?",Ses04F
Ses04M_script01_1_F042,xxx,"i don't understand you, do i?",Ses04F
Ses04M_script01_1_F043,xxx,"yeah, i can see that.",Ses04F
Ses04M_script01_1_M000,neu,he saw it.,Ses04M
Ses04M_script01_1_M001,neu,he was out here when it broke.,Ses04M
Ses04M_script01_1_M002,xxx,about four this morning. i heard it cracking and i woke up and looked out. he was standing right there when it cracked.,Ses04M
Ses04M_script01_1_M003,xxx,"i don't know. after it cracked, he ran back in the house and cried in the kitchen.",Ses04M
Ses04M_script01_1_M004,xxx,no. i - i figured the best thing was to leave him alone.,Ses04M
Ses04M_script01_1_M005,xxx,i heard him right through the floor of my room.,Ses04M
Ses04M_script01_1_M006,xxx,i guess he is.,Ses04M
Ses04M_script01_1_M007,fru,"i don't know the meaning of it, mom. but i know one thing; we made a terrible mistake with dad.",Ses04M
Ses04M_script01_1_M008,xxx,being dishonest with him. that kind of thing always pays off and now it's paying off.,Ses04M
Ses04M_script01_1_M009,xxx,you know that larry's not coming back. and i know it. why do we allow him to go on thinking that we believe with him?,Ses04M
Ses04M_script01_1_M010,fru,i don't want to argue with him but it's time he realized that nobody believes larry's alive anymore.,Ses04M
Ses04M_script01_1_M011,xxx,why shouldn't he dream of him? walk the nights waiting for him.,Ses04M
Ses04M_script01_1_M012,xxx,"do we contradict him? do we say straight out that we have no hope anymore? that we haven't had any hope for years, now.",Ses04M
Ses04M_script01_1_M013,ang,we've gotta say it to him.,Ses04M
Ses04M_script01_1_M014,ang,"for god's sake, three years. nobody comes back after three years. it's insane.",Ses04M
Ses04M_script01_1_M015,xxx,"sit down, mom. i want to talk to you.",Ses04M
Ses04M_script01_1_M016,fru,"alright, alright, alright. listen. you know why i asked annie here don't you?",Ses04M
Ses04M_script01_1_M017,fru,you know why.,Ses04M
Ses04M_script01_1_M018,neu,going to ask her to marry me.,Ses04M
Ses04M_script01_1_M019,fru,you know it's not only my business.,Ses04M
Ses04M_script01_1_M020,xxx,then it's alright. i'll go ahead with it?,Ses04M
Ses04M_script01_1_M021,ang,"well, then you know it's not only my business.",Ses04M
Ses04M_script01_1_M022,ang,"sometimes you infuriate me, you know that? isn't it your business, too, if i tell this to father and he throws a fit about it? you have such a talent for ignoring things.",Ses04M
Ses04M_script01_1_M023,fru,she's not larry's girl.,Ses04M
Ses04M_script01_1_M024,fru,"i don't know why it is but every time i reach out for something i want, i have to pull back because other people will suffer. my whole bloody life, time after time after time.",Ses04M
Ses04M_script01_1_M025,fru,to hell with that.,Ses04M
Ses04M_script01_1_M026,neu,i wanted to get this settled first.,Ses04M
Ses04M_script01_1_M027,xxx,"well if she does, then that's the end of it. from her letters, i think she's forgotten him. we'll find out. then we'll thrash it out with dad. right, mom? don't avoid me.",Ses04M
Ses04M_script01_1_M028,xxx,so what? i'm not fast with women.,Ses04M
Ses04M_script01_1_M029,fru,because it is.,Ses04M
Ses04M_script01_1_M030,fru,line?,Ses04M
Ses04M_script01_1_M031,neu,"alright, then, mom. did we skip something? no. alright, then, mom.",Ses04M
Ses04M_script01_1_M032,neu,"yeah, let's keep going.",Ses04M
Ses04M_script01_1_M033,fru,i've given it three years' of thought. i'd hope that if,Ses04M
Ses04M_script01_1_M034,sad,"father forgot about larry, we'd have a regular wedding and everything happy. if i can't get that here, then i'll have to get out.",Ses04M
Ses04M_script01_1_M035,xxx,i'll get out. i'll get married and live someplace else. maybe new york.,Ses04M
Ses04M_script01_1_M036,fru,i've been a good son too long; a good sucker. i'm through with it.,Ses04M
Ses04M_script01_1_M037,ang,the business? the business doesn't inspire me.,Ses04M
Ses04M_script01_1_M038,ang,"yes. i like getting an hour a day. if i have to grub for money all day long, at least at evening, i want it beautiful.",Ses04M
Ses04M_script01_1_M039,xxx,i want a family. i want some kids. i want to build something i can give myself to. annie's in the middle of that. now where do i find it?,Ses04M
Ses04M_script01_1_M040,neu,"yes, on this i would.",Ses04M
Ses04M_script01_1_M041,neu,then you help me stay here.,Ses04M
Ses04M_script01_1_M042,fru,i know that. just you help me stay here.,Ses04M
Ses04M_script01_1_M043,xxx,i am thinking that way.,Ses04M
Ses04M_script01_1_M044,fru,"no, you don't. i'm a pretty tough guy.",Ses04M
Ses04M_script01_2_F000,ang,why did he invite her here?,Ses04F
Ses04M_script01_2_F001,neu,why does that bother you?,Ses04F
Ses04M_script01_2_F002,ang,"she's been in new york three and a half years. why, all of a sudden--",Ses04F
Ses04M_script01_2_F003,ang,nobody comes seven hundred miles just to see.,Ses04F
Ses04M_script01_2_F004,ang,he's not going to marry her.,Ses04F
Ses04M_script01_2_F005,ang,it's got that about it.,Ses04F
Ses04M_script01_2_F006,ang,"what's going on here, joe?",Ses04F
Ses04M_script01_2_F007,neu,"now listen, kid. now, listen.",Ses04F
Ses04M_script01_2_F008,ang,"she's not his girl, joe. she knows she's not.",Ses04F
Ses04M_script01_2_F009,ang,"then why is she still single? new york is full of men. why hasn't she married? probably a hundred people told her she's foolish, but she's waited.",Ses04F
Ses04M_script01_2_F010,ang,"because she knows what i know, that's why. she's faithful as a rock. in my worst moments, i think of her waiting and i know, again, that i'm right.",Ses04F
Ses04M_script01_2_F011,ang,"nobody in this house dares take her faith away, joe. strangers might, but not his father, not his brother.",Ses04F
Ses04M_script01_2_F012,ang,"i want you to act like he's coming back, both of you. don't think i haven't noticed you since he invited her here. i won't stand for any nonsense.",Ses04F
Ses04M_script01_2_F013,ang,"because if he's not coming back, i'll kill myself.",Ses04F
Ses04M_script01_2_F014,ang,laugh. laugh at me. but why did that happen the very night that she came here?,Ses04F
Ses04M_script01_2_F015,ang,she goes to sleep in his bed and his memorial breaks in pieces. look. look at it. joe--,Ses04F
Ses04M_script01_2_F016,ang,"believe with me, joe. i can't stand all alone",Ses04F
Ses04M_script01_2_F017,xxx,"only last week, a man turned up in detroit missing longer than larry.",Ses04F
Ses04M_script01_2_F018,ang,"you, above all, have got to believe. you.",Ses04F
Ses04M_script01_2_F019,xxx,just don't stop believing.,Ses04F
Ses04M_script01_2_F020,sad,i can't help it.,Ses04F
Ses04M_script01_2_M000,neu,"oh, god, line.",Ses04M
Ses04M_script01_2_M001,xxx,"why does- why, does that bother you?",Ses04M
Ses04M_script01_2_M002,xxx,"well, maybe- maybe he just wanted to see her.",Ses04M
Ses04M_script01_2_M003,fru,what do you mean? he grew up next door to the girl all his life. why shouldn't he want to -- why shouldn't he want to see her again?,Ses04M
Ses04M_script01_2_M004,xxx,don't look at me like that. he didn't tell me anymore than he told you.,Ses04M
Ses04M_script01_2_M005,neu,how do you know he's even thinking about it?,Ses04M
Ses04M_script01_2_M006,neu,well so what?,Ses04M
Ses04M_script01_2_M007,neu,line.,Ses04M
Ses04M_script01_2_M008,xxx,"oh. now listen, kid.",Ses04M
Ses04M_script01_2_M009,xxx,you can't read her mind.,Ses04M
Ses04M_script01_2_M010,xxx,how do you know why she waited?,Ses04M
Ses04M_script01_2_M011,fru,"look, it's a nice day. what are we arguing for?",Ses04M
Ses04M_script01_2_M012,fru,what do you want me to do? what do you want?,Ses04M
Ses04M_script01_2_M013,fru,"but, kate--",Ses04M
Ses04M_script01_2_M014,fru,calm yourself.,Ses04M
Ses04M_script01_2_M015,fru,calm yourself.,Ses04M
Ses04M_script01_2_M016,fru,"alright, alright. calm yourself.",Ses04M
Ses04M_script01_2_M017,fru,why me above all?,Ses04M
Ses04M_script01_2_M018,xxx,"what does that mean, me above all? look at you. you're shaking.",Ses04M
Ses04M_script01_2_M019,ang,"what have i got to hide? what the hell is the matter with you, kate?",Ses04M
Ses04M_script01_3_F000,xxx,you're the only one i know who loves his parents.,Ses04F
Ses04M_script01_3_F001,xxx,"it's okay. it's a good thing. you know, it's lovely here and the air is sweet.",Ses04F
Ses04M_script01_3_F002,xxx,"no, not sorry, but i'm not going to stay.",Ses04F
Ses04M_script01_3_F003,xxx,"in the first place, your mother as much as told me to go.",Ses04F
Ses04M_script01_3_F004,xxx,you saw that and then you've been kind of--,Ses04F
Ses04M_script01_3_F005,xxx,"well, kind of embarrassed ever since i got here.",Ses04F
Ses04M_script01_3_F006,xxx,"i knew they would, your mother, anyway.",Ses04F
Ses04M_script01_3_F007,xxx,"from her point of view, why else would i come?",Ses04F
Ses04M_script01_3_F008,xxx,i guess this is why i came.,Ses04F
Ses04M_script01_3_F009,xxx,"chris, i've been ready a long, long time.",Ses04F
Ses04M_script01_3_F010,xxx,i almost got married two years ago.,Ses04F
Ses04M_script01_3_F011,xxx,you started to write me.,Ses04F
Ses04M_script01_3_F012,hap,every day since.,Ses04F
Ses04M_script01_3_F013,hap,"i was waiting for you, chris. 'til then, you never wrote and when you did, what did you say? you sure can be ambiguous, you know.",Ses04F
Ses04M_script01_3_F014,hap,i'll never forgive you. why did you wait all these years? all i've done is sit around and wonder if i was crazy for thinking of you.,Ses04F
Ses04M_script01_3_F015,xxx,not like that you're not.,Ses04F
Ses04M_script01_3_F016,xxx,"like larry's brother. do it like you, chris. what is it, chris?",Ses04F
Ses04M_script01_3_F017,xxx,"no, what is it, chris? your mother?",Ses04F
Ses04M_script01_3_F018,xxx,"then what's wrong. even in your letters, there was something ashamed.",Ses04F
Ses04M_script01_3_F019,xxx,you've got to tell me.,Ses04F
Ses04M_script01_3_F020,xxx,it wouldn't work this way.,Ses04F
Ses04M_script01_3_F021,xxx,"yeah, sure.",Ses04F
Ses04M_script01_3_F022,sad,how many?,Ses04F
Ses04M_script01_3_F023,sad,"oh, gees.",Ses04F
Ses04M_script01_3_F024,xxx,and do you still feel that way?,Ses04F
Ses04M_script01_3_F025,xxx,"because you mustn't feel that way anymore, chris. because you have a right to everything you have, everything, chris; to me, too.",Ses04F
Ses04M_script01_3_F026,xxx,"and your money, there's nothing wrong in your money. your father put hundreds of planes in the air. you should be proud. a man should be paid for that.",Ses04F
Ses04M_script01_3_F027,hap,what'll i do with a fortune?,Ses04F
Ses04M_script01_3_M000,xxx,"i know. it went out of style, didn't it?",Ses04M
Ses04M_script01_3_M001,xxx,so you're not sorry you came?,Ses04M
Ses04M_script01_3_M002,xxx,why?,Ses04M
Ses04M_script01_3_M003,xxx,what?,Ses04M
Ses04M_script01_3_M004,xxx,the trouble is i planned on sneaking up on you over a period of a week or so. but they take it for granted that we're all set.,Ses04M
Ses04M_script01_3_M005,xxx,how did you know?,Ses04M
Ses04M_script01_3_M006,xxx,well wouldn't you want to?,Ses04M
Ses04M_script01_3_M007,xxx,i guess you know this is why i asked you to come.,Ses04M
Ses04M_script01_3_M008,xxx,"ann, i love you. i love you a great deal. i love you.",Ses04M
Ses04M_script01_3_M009,xxx,i have no imagination. that's all i know to tell you. i'm embarrassing you.,Ses04M
Ses04M_script01_3_M010,xxx,i didn't want to tell it to you here. i wanted someplace we'd never been; someplace where we'd be brand new to each other.,Ses04M
Ses04M_script01_3_M011,xxx,"you think this is wrong, don't you; this yard, this chair? i want you to be ready for me. i don't want to win you away from anything.",Ses04M
Ses04M_script01_3_M012,xxx,then he's gone forever? you're sure?,Ses04M
Ses04M_script01_3_M013,xxx,why didn't you?,Ses04M
Ses04M_script01_3_M014,xxx,you felt something that far back?,Ses04M
Ses04M_script01_3_M015,xxx,"anne, why didn't you let me know?",Ses04M
Ses04M_script01_3_M016,xxx,"anne, give me a kiss. give me a -",Ses04M
Ses04M_script01_3_M017,xxx,"i kissed you. i kissed annie. how long, how long i've waited to kiss you.",Ses04M
Ses04M_script01_3_M018,xxx,"anne, we're going to live now. i'm going to make you so happy.",Ses04M
Ses04M_script01_3_M019,xxx,i kissed you.,Ses04M
Ses04M_script01_3_M020,xxx,let's drive somewhere. i want to be alone with you.,Ses04M
Ses04M_script01_3_M021,xxx,"no, no, nothing like that.",Ses04M
Ses04M_script01_3_M022,sad,"yes, i suppose there has been. but it's going from me.",Ses04M
Ses04M_script01_3_M023,sad,i don't know where to start.,Ses04M
Ses04M_script01_3_M024,sad,"it's all mixed up with so many other things. you remember overseas, i was in command of a company?",Ses04M
Ses04M_script01_3_M025,sad,well i lost them.,Ses04M
Ses04M_script01_3_M026,sad,just about all.,Ses04M
Ses04M_script01_3_M027,sad,it takes a little time to toss that off because they weren't just men.,Ses04M
Ses04M_script01_3_M028,sad,"for instance, one time it'd been raining several days. and this kid came to me and gave me his last pair of dry socks; put them in my pocket. that's only a little thing, but that's the kind of guys i had.",Ses04M
Ses04M_script01_3_M029,xxx,they didn't die. they killed themselves for each other. i mean that exactly. a little more selfish and they'd have been here today.,Ses04M
Ses04M_script01_3_M030,sad,"and i got this idea watching them go down, everything was being destroyed, see? but, to me, it seemed there was one new thing that was made,",Ses04M
Ses04M_script01_3_M031,sad,a kind of responsibility. man for man. you understand me? and then i went home and it was incredible.,Ses04M
Ses04M_script01_3_M032,sad,"there was no meaning in it here. the whole thing to them was some sort of bus accident. then i went to work for dad and that whole rat race again. i felt, what you said, ashamed somehow",Ses04M
Ses04M_script01_3_M033,sad,because nobody was changed. it seemed to make suckers out of a lot of guys. i felt wrong to be alive;,Ses04M
Ses04M_script01_3_M034,sad,"to open that bank book; to drive the new car; to see the new refrigerator. i mean, you can take these things out of a war, but when you drive the new car, you have to know that it came out of the love a man can have for a man.",Ses04M
Ses04M_script01_3_M035,sad,"you have to be a little better because of that. otherwise, we have is really loot and there's blood on it. i don't want to take any of it. i guess that included you.",Ses04M
Ses04M_script01_3_M036,xxx,"i want you now, annie.",Ses04M
Ses04M_script01_3_M037,hap,"annie, annie, i'm going to make you a fortune.",Ses04M
Ses04M_script02_1_F000,neu,fine.,Ses04F
Ses04M_script02_1_F001,xxx,what flashlight?,Ses04F
Ses04M_script02_1_F002,ang,it's not yours.,Ses04F
Ses04M_script02_1_F003,ang,"it's ours. it's mine, too.",Ses04F
Ses04M_script02_1_F004,ang,you kept saying my flashlight as if it's somehow just yours. how is that supposed to make me feel?,Ses04F
Ses04M_script02_1_F005,ang,yes.,Ses04F
Ses04M_script02_1_F006,xxx,i'm cold.,Ses04F
Ses04M_script02_1_F007,ang,it's after eleven; let's go home.,Ses04F
Ses04M_script02_1_F008,ang,there is no point in coming down here.,Ses04F
Ses04M_script02_1_F009,fru,that's my point.,Ses04F
Ses04M_script02_1_F010,ang,so let's go home.,Ses04F
Ses04M_script02_1_F011,fru,not particularly.,Ses04F
Ses04M_script02_1_F012,ang,i just don't. it's stupid.,Ses04F
Ses04M_script02_1_F013,ang,"pass up what? these little fish swim onto the beach, flop around and then they swim away. and then they die.",Ses04F
Ses04M_script02_1_F014,neu,what are you so excited about?,Ses04F
Ses04M_script02_1_F015,fru,this isn't a moon landing we're talking about. it's fish. it's fish nobody even eats.,Ses04F
Ses04M_script02_1_F016,fru,i'm just not.,Ses04F
Ses04M_script02_1_F017,ang,yes.,Ses04F
Ses04M_script02_1_F018,ang,"last year, you will also remember, our shoes got wet. i got sand in my panties. we got into a big fight over nothing. you got a sore throat and we did not see the grunions.",Ses04F
Ses04M_script02_1_F019,fru,we didn't see them the first time either.,Ses04F
Ses04M_script02_1_F020,fru,that's the wind.,Ses04F
Ses04M_script02_1_F021,fru,about what?,Ses04F
Ses04M_script02_1_M000,xxx,"what time is it? they're supposed to run around midnight. this is great, isn't it? look at this night we've got here; couldn't be better.",Ses04M
Ses04M_script02_1_M001,hap,"actually, i wanted to go a little farther up the coast, get away from the lights and the people, but i was afraid we'd miss it. how you doing?",Ses04M
Ses04M_script02_1_M002,hap,"is that, is that - is that just foam? i can't even tell. although, if you can't tell, it's probably isn't them. it'll probably be unmistakable, don't you think?",Ses04M
Ses04M_script02_1_M003,hap,"how you doing? oh, no, you know what i did? i forgot to bring my flashlight. how could i be so stupid? i should have brought my flashlight.",Ses04M
Ses04M_script02_1_M004,xxx,"the flashlight; the silver one. there's only one, isn't there?",Ses04M
Ses04M_script02_1_M005,neu,whose is it?,Ses04M
Ses04M_script02_1_M006,fru,"well, sure.",Ses04M
Ses04M_script02_1_M007,xxx,"no, of course, our flashlight; yours and mine. me flashlight es su flashlight, naturally. how could we not think to bring it? i hope the moon stays out.",Ses04M
Ses04M_script02_1_M008,hap,"i wonder, do they always run during a full moon? i can't remember if it was full last year. remember?",Ses04M
Ses04M_script02_1_M009,neu,"are you cold? do you want my jacket? we should have brought the blanket, our blanket.",Ses04M
Ses04M_script02_1_M010,xxx,"oh, man. this is great. i didn't even think to bring a six pack. six pack would be just the ticket right about now. i can't believe i forgot. i'm like a kid. it's amazing i got out of the house with my fly zipped. oh.",Ses04M
Ses04M_script02_1_M011,xxx,i wonder if they can hear me talk or feel the vibrations in the sand when we move around.,Ses04M
Ses04M_script02_1_M012,neu,you want my jacket?,Ses04M
Ses04M_script02_1_M013,fru,are you kidding? we'd miss it. we just got here. what's the point of coming down here if we just turn around and go home?,Ses04M
Ses04M_script02_1_M014,neu,right.,Ses04M
Ses04M_script02_1_M015,neu,"that's my point, too.",Ses04M
Ses04M_script02_1_M016,fru,"no, no, no. that's not my point. my point is is that there's no point in coming down here if we just leave. don't you want to see it?",Ses04M
Ses04M_script02_1_M017,xxx,why not?,Ses04M
Ses04M_script02_1_M018,hap,"honey, this is a natural phenomenon. i mean, this only happens once a year. it's a great opportunity. think about the people in kansas. they'd have to get plane tickets and hotel reservations to come see this. we're just forty minutes away. it's too good to pass up.",Ses04M
Ses04M_script02_1_M019,fru,"yeah, but that moment on the beach is the highlight of their little lives. i mean, all that flopping around is laying eggs or what do you -- spawning or mating, something like that.",Ses04M
Ses04M_script02_1_M020,hap,there's mystery here and magic.,Ses04M
Ses04M_script02_1_M021,hap,"oh, it's a big night for these guys. uh, life's last orgy.",Ses04M
Ses04M_script02_1_M022,hap,"yeah, they do. okay. but it's fish who do something none of the other fish do; like the swallows are returning to capistrano; or the lemmings throwing themselves off the cliffs, like that.",Ses04M
Ses04M_script02_1_M023,hap,there's mystery here and magic; a little bit of the unexplainable. i don't see how you can not be interested.,Ses04M
Ses04M_script02_1_M024,sur,for real?,Ses04M
Ses04M_script02_1_M025,xxx,"i don't get it. first time we came here to see it, you said it was the best night of your life. and last year, i remember distinctly you were so excited to get here, you stubbed your toe rushing me out the door and didn't even notice until we were in the car.",Ses04M
Ses04M_script02_1_M026,xxx,we weren't in a good spot.,Ses04M
