file,emotion,text,speaker
Ses03M_impro08a_F012,fru,"no, no, no... i'm done with these contract business because this is what can happen.",Ses03F
Ses03M_impro08a_F013,ang,"you sign the contract and then down the line the phone doesn't work and you're stuck, you can't go to a new...no. no contracts for me. you give me a new phone.",Ses03F
Ses03M_impro08a_F014,ang,i want to talk to a supervisor,Ses03F
Ses03M_impro08a_F015,ang,i would like to talk to your supervisor. obviously you're incompetent and don't understand what i'm asking.,Ses03F
Ses03M_impro08a_F016,fru,what?,Ses03F
Ses03M_impro08a_F017,fru,that's ridiculous. you know?,Ses03F
Ses03M_impro08a_F018,fru,"no i don't want to call back, you put me on hold for like hours and hours----and it's money, money, money, money and out of my pocket, out of my pocket--",Ses03F
Ses03M_impro08a_F019,fru,every phone...every single phone company?,Ses03F
Ses03M_impro08a_F020,ang,this is ridiculous.well what are we supposed to do? we starve then because i can't use my phone cause,Ses03F
Ses03M_impro08a_F021,ang,"i am a realtor and this is my business. people are calling me all the time but you know, and i don't have a land line. i can't afford to have a land line",Ses03F
Ses03M_impro08a_F022,ang,that you better be sorry.,Ses03F
Ses03M_impro08a_F023,fru,well you're not helping me at all. god this is so frustrating.,Ses03F
Ses03M_impro08a_F024,fru,what? no. that's way too complicated. look--,Ses03F
Ses03M_impro08a_F025,fru,you need to fix my phone. i don't care what you have to do--,Ses03F
Ses03M_impro08a_F026,xxx,"well then go up the freaking pole and fix it like, you need to help me. you don't understand i'm in dire, dire need of a phone right now.",Ses03F
Ses03M_impro08a_F027,fru,"yeah yeah, woman going out in south central on the payphone at night. oh that's real safe.",Ses03F
Ses03M_impro08a_F028,fru,"no, no, no. i didn't choose to live here. i work there. okay? yeah. work work work",Ses03F
Ses03M_impro08a_F029,fru,"we can't call out. we can't make out-- line. i don't work, i work at another office.",Ses03F
Ses03M_impro08a_F030,fru,a law firm. thank you very much.,Ses03F
Ses03M_impro08a_F031,fru,"i work out of my home as a realtor and because i don't have a land line, i need a phone and because of now i don't have one i don't know what to do. and you're not helping me at all.",Ses03F
Ses03M_impro08a_F032,fru,"in fact, give me your name sir, what's your name again?",Ses03F
Ses03M_impro08a_F033,fru,okay. sara what?,Ses03F
Ses03M_impro08a_F034,fru,"sara brown. sara brown, um- yeah, i'm going to get off the phone with you. and then i'm going to call back and i'm going to give your supervisor your name because you're obviously incompetent to work here.",Ses03F
Ses03M_impro08a_F035,fru,"what are you, what are you a police officer now? you know, like i'm done, i'm over it. goodbye and i hope that you lose your job.",Ses03F
Ses03M_impro08a_M000,neu,hello. this is viacom services. how can i help you?,Ses03M
Ses03M_impro08a_M001,neu,"i'm sorry ma'am, what can i help you with?",Ses03M
Ses03M_impro08a_M002,neu,okay. can you give me the last four digits of your social security number so i can verify who i'm speaking with?,Ses03M
Ses03M_impro08a_M003,neu,okay. and your name is?,Ses03M
Ses03M_impro08a_M004,neu,olivia. um. okay. so how long has this problem been?,Ses03M
Ses03M_impro08a_M005,neu,so what exactly is the problem?,Ses03M
Ses03M_impro08a_M006,neu,um- i think part of it has to do with the network being down. it's been having some trouble the last few weeks--,Ses03M
Ses03M_impro08a_M007,neu,i understand--we're not-,Ses03M
Ses03M_impro08a_M008,neu,no. okay. we're not charging you for any of these months. we're going to give you three months free.,Ses03M
Ses03M_impro08a_M009,neu,we can give you a new phone--,Ses03M
Ses03M_impro08a_M010,neu,we can do that. we can do that. you just have to sign a one-year contract though with the--,Ses03M
Ses03M_impro08a_M011,fru,"besides, it's sort of out of hands at the moment----the whole electrical power outage.",Ses03M
Ses03M_impro08a_M012,neu,"um- let me connect you to my supervisor. actually, he's out right now so i'm supervisor until he comes back. um-",Ses03M
Ses03M_impro08a_M013,neu,"so you could----speak with me some more, you could call back later on maybe.",Ses03M
Ses03M_impro08a_M014,fru,i didn't put you on hold.,Ses03M
Ses03M_impro08a_M015,fru,there are a lot of people calling us having problems. every phone company is having the same problems ma'am,Ses03M
Ses03M_impro08a_M016,neu,"mmm hmmm. mmm hmmm. the power outages, everything, hurricane katrina. everything's really messed up.",Ses03M
Ses03M_impro08a_M017,neu,don't you-,Ses03M
Ses03M_impro08a_M018,neu,i'm really sorry ma'am. there's not----a lot we can do for it.,Ses03M
Ses03M_impro08a_M019,neu,"what i can do for you, if you want to make a call right now i could contact you through our computer. i can call through my phone and you can speak through me.",Ses03M
Ses03M_impro08a_M020,neu,i'm sorry it has to do with an electrical power outage and stuff--,Ses03M
Ses03M_impro08a_M021,neu,"well, okay i'm going to give you a free phone card that you can use at any payphone and that's on us. okay?",Ses03M
Ses03M_impro08a_M022,neu,"i'm, i'm sorry you chose to live there um--",Ses03M
Ses03M_impro08a_M023,neu,well i'm sure maybe there's a phone at work you could use.,Ses03M
Ses03M_impro08a_M024,neu,all right um--,Ses03M
Ses03M_impro08a_M025,neu,my name is sara.,Ses03M
Ses03M_impro08a_M026,neu,sara brown.,Ses03M
Ses03M_impro08a_M027,neu,"you know maam, we record this conversation so anything you say can be proven in a law of court so keep that in mind.",Ses03M
Ses03M_impro08b_F000,xxx,hello.,Ses03F
Ses03M_impro08b_F001,fru,oh god i finally got...you know how long i've been waiting on line? you put on hold for like five hours. geez.,Ses03F
Ses03M_impro08b_F002,fru,i've already been through this five times with these people. i've been calling every single day.,Ses03F
Ses03M_impro08b_F003,fru,olivia brown.,Ses03F
Ses03M_impro08b_F004,fru,well my phone isn't working and it hasn't been working for the last five days.,Ses03F
Ses03M_impro08b_F005,ang,"yeah, yeah, yeah you better be sorry.",Ses03F
Ses03M_impro08b_F006,ang,no i did not drop my phone in water. i'm not five years old and just dropped my phone anywhere i see it. okay this is my business.,Ses03F
Ses03M_impro08b_F007,fru,okay? and it [garbage]. my business is failing because my phone isn't working and i don't have a land line and i really can't handle this right now.,Ses03F
Ses03M_impro08b_F008,fru,"the symptoms- this [garbage] a doctor's office. i'm not receiving calls...i can't receive- no, it's, it cuts me off--",Ses03F
Ses03M_impro08b_F009,fru,yes the phone turns on. no i mean i'm using it not turning on the phone. of course it turns on.,Ses03F
Ses03M_impro08b_F010,fru,no- i don't have a sim card because it's verizon and you guys don't use sim cards.,Ses03F
Ses03M_impro08b_F011,fru,"okay no. sir, this is the deal. my phone isn't working and i don't care what the problem is but it needs to work. that's why i'm paying you guys to fix it.",Ses03F
Ses03M_impro08b_F012,fru,i don't know even how to use that stuff it's too complicated. i just want my flip phone to work----that's all i need,Ses03F
Ses03M_impro08b_F013,fru,"look, i am on the road all the time. do you understand how important? i'm a woman, a single mother by herself working...what?",Ses03F
Ses03M_impro08b_F014,fru,"brent backersen, i am writing this down, brent backersen. alright.",Ses03F
Ses03M_impro08b_F015,fru,"i, i, i don't want a contract. okay. i don't want any contracts.",Ses03F
Ses03M_impro08b_F016,fru,really? no contract?,Ses03F
Ses03M_impro08b_F017,xxx,i want the best freaking camera phone there is though. i want the really good kind--,Ses03F
Ses03M_impro08b_F018,xxx,and palm pilot.,Ses03F
Ses03M_impro08b_F019,xxx,and charger and accessories and i want a cover that's pink.,Ses03F
Ses03M_impro08b_F020,xxx,no,Ses03F
Ses03M_impro08b_F021,neu,"alright. well- i guess - i guess that's okay but,",Ses03F
Ses03M_impro08b_F022,xxx,you better promise me.,Ses03F
Ses03M_impro08b_F023,neu,okay.,Ses03F
Ses03M_impro08b_F024,neu,alright thanks.,Ses03F
Ses03M_impro08b_M000,neu,hello?,Ses03M
Ses03M_impro08b_M001,neu,i'm sorry ma'am. what's the nature of your problem? but first can i get you to tell me your first and last name?,Ses03M
Ses03M_impro08b_M002,neu,i know i just need to verify every time. i'm sorry.,Ses03M
Ses03M_impro08b_M003,neu,alright ms. brown what's the nature of your problem?,Ses03M
Ses03M_impro08b_M004,neu,oh. i'm sorry. um- did you drop it in water?,Ses03M
Ses03M_impro08b_M005,neu,"um- well it's probably easy. can you any more symptoms either you're not receiving calls----ok, you're not receiving calls, not getting calls.",Ses03M
Ses03M_impro08b_M006,neu,is the phone turned on?,Ses03M
Ses03M_impro08b_M007,neu,"well, um- okay. your sim card is in- didn't fall out-",Ses03M
Ses03M_impro08b_M008,neu,alright. um- well that could be the problem. cause--,Ses03M
Ses03M_impro08b_M009,neu,you might have an older phone where we would use sim cards but probably not.,Ses03M
Ses03M_impro08b_M010,neu,okay. how about this we'll send you a brand new camera phone with palm pilot-- and-,Ses03M
Ses03M_impro08b_M011,neu,"so we'll send it- and we'll give you, how about a free year's service?",Ses03M
Ses03M_impro08b_M012,neu,tell them my name. my name is brent backersen.,Ses03M
Ses03M_impro08b_M013,neu,okay. tell them my - my id number is two one three five.,Ses03M
Ses03M_impro08b_M014,neu,"tell them that. you can go in, get a brand new phone, they'll hook you up with service even give you a free three months--",Ses03M
Ses03M_impro08b_M015,neu,it will be free. no contract okay?,Ses03M
Ses03M_impro08b_M016,neu,"go in there, yeah, go in there. tell them brent backersen sent you.",Ses03M
Ses03M_impro08b_M017,neu,"the top of the line camera phone, game boy, anything you want. for free. and palm pilot.",Ses03M
Ses03M_impro08b_M018,neu,they might only have orange.,Ses03M
Ses03M_impro08b_M019,neu,"okay. they can figure out pink for you. so go in there and just tell them that and they'll hook you up with other goodies, stuff like that free service, no contract, no nothing. just for being a good customer",Ses03M
Ses03M_impro08b_M020,neu,and battling through with us.,Ses03M
Ses03M_impro08b_M021,neu,yes. you just tell them brent backersen sent you.,Ses03M
Ses03M_impro08b_M022,neu,alright? great. have a nice evening.,Ses03M
Ses03M_script01_1_F000,neu,what's he going to say? maybe we ought to talk to him before he sees it.,Ses03F
Ses03M_script01_1_F001,sur,"what do you mean. he couldn't have seen it. i was the first one up, he was still in bed.",Ses03F
Ses03M_script01_1_F002,sur,when?,Ses03F
Ses03M_script01_1_F003,xxx,well what was he doing out at four in the morning?,Ses03F
Ses03M_script01_1_F004,sad,did you talk to him?,Ses03F
Ses03M_script01_1_F005,sad,he cried hard?,Ses03F
Ses03M_script01_1_F006,xxx,"god, what was he doing out there anyway?",Ses03F
Ses03M_script01_1_F007,fru,starting to dream about him again. he's walking around at night again.,Ses03F
Ses03M_script01_1_F008,sad,"he's getting just like he did after he died, you know? what, what, what's the meaning of this?",Ses03F
Ses03M_script01_1_F009,xxx,what?,Ses03F
Ses03M_script01_1_F010,xxx,what do you mean dishonest?,Ses03F
Ses03M_script01_1_F011,xxx,what are you going to do? you want to argue with him?,Ses03F
Ses03M_script01_1_F012,xxx,you can't say that to him.,Ses03F
Ses03M_script01_1_F013,fru,how are you going to prove it? can you prove it?,Ses03F
Ses03M_script01_1_F014,xxx,"to you maybe, to me, but not to your father. i mean,",Ses03F
Ses03M_script01_1_F015,fru,he still thinks he's alive still. i mean you could talk yourself blue in the face and there's no body and there's no grave so where are you?,Ses03F
Ses03M_script01_1_F016,ang,no. it's his god damned newspapers is what it is. now every month there's a new boy comes home and larry's going to be the next one.,Ses03F
Ses03M_script01_1_F017,ang,why?,Ses03F
Ses03M_script01_1_F018,xxx,well i have an idea but i don't know. what's the story?,Ses03F
Ses03M_script01_1_F019,xxx,well that's your business chris.,Ses03F
Ses03M_script01_1_F020,ang,"well what do you want me to do? i mean, you're old enough to know your own mind.",Ses03F
Ses03M_script01_1_F021,neu,"well, i mean, you got to make sure your dad's not going--",Ses03F
Ses03M_script01_1_F022,fru,well i'm just saying--,Ses03F
Ses03M_script01_1_F023,xxx,you know i ignore what i got to ignore.,Ses03F
Ses03M_script01_1_F024,xxx,she's not...she's larry's girl.,Ses03F
Ses03M_script01_1_F025,fru,from your father's point of view he is still alive and if you try and take her that's just not fair. you can't do that.,Ses03F
Ses03M_script01_1_F026,fru,"and-and-and if you go on from there if you know already to go on from there, then you can. but i'm telling you something that i don't know where to go. you got it? i mean, do you?",Ses03F
Ses03M_script01_1_F027,xxx,you're a considerate fellow. there is nothing wrong in that.,Ses03F
Ses03M_script01_1_F028,neu,did you ask annie yet?,Ses03F
Ses03M_script01_1_F029,xxx,and what if she doesn't marry you huh? what if she feels the same way your father does?,Ses03F
Ses03M_script01_1_F030,neu,"look, you never had seen many, many women. you know? i mean...",Ses03F
Ses03M_script01_1_F031,fru,well i just don't see why it has to be annie.,Ses03F
Ses03M_script01_1_F032,xxx,"well that's a good answer but, it doesn't answer anything. you haven't seen her since you left to go to the war and it's been five years.",Ses03F
Ses03M_script01_1_F033,fru,no i don't want a diagram.,Ses03F
Ses03M_script01_1_F034,fru,"he thinks he's coming back. and you go off and marry that girl and you're just pronouncing him dead and what's going to happen to him? i don't know. do you? i mean, i don't know.",Ses03F
Ses03M_script01_1_F035,xxx,"look, just give it some thought okay?",Ses03F
Ses03M_script01_1_F036,xxx,what the hell is this?,Ses03F
Ses03M_script01_1_F037,xxx,are you crazy?,Ses03F
Ses03M_script01_1_F038,ang,you're just going to leave the business? you have a business here. you can't do that.,Ses03F
Ses03M_script01_1_F039,xxx,"oh, you have to be inspired.",Ses03F
Ses03M_script01_1_F040,sad,tell me something. you can leave this business?,Ses03F
Ses03M_script01_1_F041,xxx,you can't talk like that.,Ses03F
Ses03M_script01_1_F042,fru,alright but you can't talk like that you hear?,Ses03F
Ses03M_script01_1_F043,ang,"i mean what the hell have we worked for then? i mean, it's all for you chris. the whole shooting match is for you.",Ses03F
Ses03M_script01_1_F044,fru,alright but you don't talk like that you hear? you don't.,Ses03F
Ses03M_script01_1_F045,sad,i don't understand you do i?,Ses03F
Ses03M_script01_1_F046,sad,yeah. i can see that.,Ses03F
Ses03M_script01_1_M000,sad,he saw it.,Ses03M
Ses03M_script01_1_M001,sad,he was out there when it happened.,Ses03M
Ses03M_script01_1_M002,sad,about four in the morning. i heard a crack and i looked out and he was standing right there when it happened.,Ses03M
Ses03M_script01_1_M003,sad,i don't know. but after it cracked he ran back into the house and he cried in the kitchen.,Ses03M
Ses03M_script01_1_M004,sad,no. i figured the best thing to do was leave him alone.,Ses03M
Ses03M_script01_1_M005,sad,i could hear it right through the floor.,Ses03M
Ses03M_script01_1_M006,sad,i guess he is.,Ses03M
Ses03M_script01_1_M007,sad,"i don't know. but i know one thing mom, we made a terrible mistake with dad.",Ses03M
Ses03M_script01_1_M008,fru,being dishonest with him. that kind of thing always pays off and now it's paying off.,Ses03M
Ses03M_script01_1_M009,ang,you know that larry's not coming back and i know that too. why we both go on letting him think that we both believe with him.,Ses03M
Ses03M_script01_1_M010,fru,"no i don't want to argue with him but, it's time that he realizes that nobody believes larry's coming back anymore.",Ses03M
Ses03M_script01_1_M011,ang,"why shouldn't he walk around and dream at him at night. walk around. why shouldn't he walk around? why shouldn't he dream of him, walk around at night waiting for him? do we contradict him? do we say flat out that we don't have anymore hope?",Ses03M
Ses03M_script01_1_M012,ang,that we haven't had any hope for years now?,Ses03M
Ses03M_script01_1_M013,xxx,we got to say it to him.,Ses03M
Ses03M_script01_1_M014,fru,larry's been gone for three years. for god sakes no one comes back after three years. it's insane.,Ses03M
Ses03M_script01_1_M015,fru,"listen mom, just, sit down. i want to talk to you.",Ses03M
Ses03M_script01_1_M016,fru,alright. alright. alright just listen.,Ses03M
Ses03M_script01_1_M017,neu,"you know why i asked annie here, right?",Ses03M
Ses03M_script01_1_M018,xxx,you know.,Ses03M
Ses03M_script01_1_M019,neu,i want to ask her to marry me.,Ses03M
Ses03M_script01_1_M020,fru,you know it's not just my business.,Ses03M
Ses03M_script01_1_M021,neu,okay. so then it's alright. i'll go ahead with it.,Ses03M
Ses03M_script01_1_M022,ang,oh see then it's just not my business. god you infuriate me sometimes. isn't my business too if dad throws a fit? huh? god you have such a talent for ignoring things.,Ses03M
Ses03M_script01_1_M023,fru,she's not larry's girl.,Ses03M
Ses03M_script01_1_M024,fru,i don't know why it is but every time i reach out for something i want i have to pull back,Ses03M
Ses03M_script01_1_M025,xxx,because other people will suffer.,Ses03M
Ses03M_script01_1_M026,fru,"my whole entire, bloody life time and time again.",Ses03M
Ses03M_script01_1_M027,ang,well to hell with that.,Ses03M
Ses03M_script01_1_M028,neu,i wanted to get this settled first.,Ses03M
Ses03M_script01_1_M029,neu,then i guess that's the end of it.,Ses03M
Ses03M_script01_1_M030,sad,but from her letters i think she's forgotten him. i'll find out.,Ses03M
Ses03M_script01_1_M031,neu,"and then we'll thrash it out with dad right? mom, don't avoid me.",Ses03M
Ses03M_script01_1_M032,xxx,well so what? i'm just not fast with women.,Ses03M
Ses03M_script01_1_M033,fru,because it is.,Ses03M
Ses03M_script01_1_M034,fru,it's just...that's just the way it is. that's how i feel. you know these years when i think of someone i want to marry i think of annie. what do you want a diagram?,Ses03M
Ses03M_script01_1_M035,fru,alright then.,Ses03M
Ses03M_script01_1_M036,sad,i've given it three years of thought and i thought that if i waited then dad would forget about larry and then we could have a regular wedding and everything happy.,Ses03M
Ses03M_script01_1_M037,neu,but if i can't have that here i'll get out.,Ses03M
Ses03M_script01_1_M038,neu,i'll get out. i'll marry her somewhere else. maybe new york.,Ses03M
Ses03M_script01_1_M039,ang,i've been a good son too long. a good sucker and i'm through with it.,Ses03M
Ses03M_script01_1_M040,ang,the business doesn't inspire me.,Ses03M
Ses03M_script01_1_M041,ang,yes. i like it an hour out of the day. if i have to grub for money all day long at least at evening i want it beautiful. i want a family. i want a wife. i want some kids. i want to build something i can give myself to.,Ses03M
Ses03M_script01_1_M042,fru,now annie is in the middle of all that. where do i find it?,Ses03M
Ses03M_script01_1_M043,neu,yes. on this i would.,Ses03M
Ses03M_script01_1_M044,xxx,then help me stay here.,Ses03M
Ses03M_script01_1_M045,sad,i know. just you help me stay here.,Ses03M
Ses03M_script01_1_M046,sad,i am thinking like that.,Ses03M
Ses03M_script01_1_M047,sad,no you don't. i'm a pretty tough guy.,Ses03M
Ses03M_script01_2_F000,ang,why did he invite her here?,Ses03F
Ses03M_script01_2_F001,ang,well she's been away for three and a half years in new york and suddenly she just shows up.,Ses03F
Ses03M_script01_2_F002,xxx,nobody travels seven hundred miles just see.,Ses03F
Ses03M_script01_2_F003,xxx,he's not going to marry her.,Ses03F
Ses03M_script01_2_F004,xxx,i see it. it has the appearance of it.,Ses03F
Ses03M_script01_2_F005,xxx,what's going on here joe?,Ses03F
Ses03M_script01_2_F006,ang,no. she's not his girl joe and she knows that.,Ses03F
Ses03M_script01_2_F007,xxx,"then why is still single? i mean there's plenty of single men in new york. why isn't she married by now? probably a hundred men has told her that she's foolish but, she's waiting.",Ses03F
Ses03M_script01_2_F008,xxx,"because she knows what i know, that's why.",Ses03F
Ses03M_script01_2_F009,ang,"i mean, her faith is stronger than a rock.",Ses03F
Ses03M_script01_2_F010,sad,"my worst times i think about her, you know, and i",Ses03F
Ses03M_script01_2_F011,sad,it's like i know as long as she's waiting i'm right again.,Ses03F
Ses03M_script01_2_F012,ang,"no. nobody in my house better dare and challenge her faith. you know and maybe strangers but not his father, not his brother.",Ses03F
Ses03M_script01_2_F013,xxx,i want-i want you to act like he's still alive. i mean don't think i haven't seen the way that you've been since he invited her here.,Ses03F
Ses03M_script01_2_F014,xxx,but i won't have any of this nonsense because you know what happens? if he doesn't come back i'll kill myself.,Ses03F
Ses03M_script01_2_F015,ang,"laugh, laugh at me but i will. because you know what happened when she came here? when she came back she slept in his room, the memorial broke into pieces. joe, look. look at it. you got to believe with me.",Ses03F
Ses03M_script01_2_F016,xxx,i can't do it all alone.,Ses03F
Ses03M_script01_2_F017,sad,"look, it was just last week that detroit, some boy came back he had been away longer than larry, you can read it for yourself. you above all people have got to believe.",Ses03F
Ses03M_script01_2_F018,xxx,"look, just keep believing okay?",Ses03F
Ses03M_script01_2_F019,sad,i can't help it.,Ses03F
Ses03M_script01_2_M000,fru,why does that bother you?,Ses03M
Ses03M_script01_2_M001,neu,"well maybe, maybe he just wanted to see her.",Ses03M
Ses03M_script01_2_M002,fru,uh-uh what do you mean? they grew up next to each other their entire lives. why shouldn't he want to see her?,Ses03M
Ses03M_script01_2_M003,fru,hey don't look at me like that. i don't know anymore than you.,Ses03M
Ses03M_script01_2_M004,neu,who said he even thought about that?,Ses03M
Ses03M_script01_2_M005,neu,"well, so what?",Ses03M
Ses03M_script01_2_M006,fru,now listen kid...,Ses03M
Ses03M_script01_2_M007,xxx,you can't read her mind.,Ses03M
Ses03M_script01_2_M008,neu,how do you know why she's waited? hmmm?,Ses03M
Ses03M_script01_2_M009,fru,look at how nice the day is. what are we arguing for?,Ses03M
Ses03M_script01_2_M010,fru,what do you want me to do? what do you want?,Ses03M
Ses03M_script01_2_M011,fru,but kate...,Ses03M
Ses03M_script01_2_M012,fru,okay. calm yourself. just calm yourself.,Ses03M
Ses03M_script01_2_M013,xxx,"calm yourself, alright?",Ses03M
Ses03M_script01_2_M014,ang,"alright, alright, calm yourself okay? calm yourself. wait, wait. what do you mean, me above all?",Ses03M
Ses03M_script01_2_M015,ang,"wait, what does that mean? me above all?",Ses03M
Ses03M_script01_2_M016,ang,"look at you, you're shaking.",Ses03M
Ses03M_script01_2_M017,ang,what do i got to hide? huh? what the hell's the matter with you kate?,Ses03M
Ses03M_script01_3_F000,xxx,you're the only one i know that still loves his parents.,Ses03F
Ses03M_script01_3_F001,xxx,"no. it's alright. it's a good thing, you know?",Ses03F
Ses03M_script01_3_F002,xxx,it's lovely here.,Ses03F
Ses03M_script01_3_F003,xxx,the air is so sweet.,Ses03F
Ses03M_script01_3_F004,sad,no. i'm not sorry. but i'm not going to stay.,Ses03F
Ses03M_script01_3_F005,xxx,first of all your mother so much as told me to go.,Ses03F
Ses03M_script01_3_F006,sad,"look,",Ses03F
Ses03M_script01_3_F007,sad,"you saw the way that she acted and then well, i mean, you, you were acting kind of...",Ses03F
Ses03M_script01_3_F008,sad,"well, i don't know, embarrassed of her since i came.",Ses03F
Ses03M_script01_3_F009,xxx,"yeah. i know they would, especially your mother.",Ses03F
Ses03M_script01_3_F010,xxx,"well what other reason, from her point of view, would i be coming here?",Ses03F
Ses03M_script01_3_F011,hap,"well,",Ses03F
Ses03M_script01_3_F012,hap,i guess that's why i came.,Ses03F
Ses03M_script01_3_F013,hap,"look, i've been ready for a long, long time now.",Ses03F
Ses03M_script01_3_F014,hap,"look, i almost got married two years ago.",Ses03F
Ses03M_script01_3_F015,hap,you started to write me.,Ses03F
Ses03M_script01_3_F016,hap,every day since.,Ses03F
Ses03M_script01_3_F017,hap,"i was waiting for you chris, i mean, till then you never wrote and then when you did what did you say?",Ses03F
Ses03M_script01_3_F018,hap,you'd always be so ambiguous.,Ses03F
Ses03M_script01_3_F019,hap,i'll never forgive you for that.,Ses03F
Ses03M_script01_3_F020,hap,"i mean, why did you wait all these years? there i was sitting around and wondering if i was crazy for thinking about you.",Ses03F
Ses03M_script01_3_F021,hap,not like that you're not.,Ses03F
Ses03M_script01_3_F022,xxx,like larry's brother. do it like you chris.,Ses03F
Ses03M_script01_3_F023,xxx,what is it?,Ses03F
Ses03M_script01_3_F024,xxx,"no, what is it? your mother?",Ses03F
Ses03M_script01_3_F025,xxx,"tell me what's wrong. i mean, even in your letters you seemed ashamed.",Ses03F
Ses03M_script01_3_F026,xxx,you got to tell me.,Ses03F
Ses03M_script01_3_F027,xxx,okay. it wouldn't work like this?,Ses03F
Ses03M_script01_3_F028,xxx,"yeah, sure.",Ses03F
Ses03M_script01_3_F029,sad,how many?,Ses03F
Ses03M_script01_3_F030,sad,geez.,Ses03F
Ses03M_script01_3_F031,sad,and you still feel that way?,Ses03F
Ses03M_script01_3_F032,xxx,cause you must not feel that way again. you hear me? you can't. you deserve everything you have chris.,Ses03F
Ses03M_script01_3_F033,sad,"that includes me too, i mean and the money, you have right to that money. your father put planes up in the air, good planes and he deserves it, you should be proud of that. a man should be paid for that.",Ses03F
