file,emotion,text,speaker
Ses04M_impro06_M011,sad,this is just -- this is a terrible life. i just don't understand.,Ses04M
Ses04M_impro06_M012,sad,"i mean, it's just not fair. like, i don't know. why people -",Ses04M
Ses04M_impro06_M013,sad,"there should just be some sort of rule that people don't die until they're older, 'cause then, at least, it's expected.",Ses04M
Ses04M_impro06_M014,sad,i don't know what to do.,Ses04M
Ses04M_impro06_M015,sad,"i mean, you- you can go. i don't know. i don't know what else.",Ses04M
Ses04M_impro06_M016,sad,i hope it rains. somehow that'll make me feel more comfortable.,Ses04M
Ses04M_impro06_M017,sad,yeah.,Ses04M
Ses04M_impro06_M018,sad,i just wish there was some way to just bring him back to life magically.,Ses04M
Ses04M_impro06_M019,sad,"just, you know, some thing; some genie. i need to find a genie bottle.",Ses04M
Ses04M_impro06_M020,sad,i know.,Ses04M
Ses04M_impro07_F002,hap,i didn't even,Ses04F
Ses04M_impro07_F003,hap,know you applied to u.s.c..,Ses04F
Ses04M_impro07_F004,hap,"that's amazing. i've seen it on tv. um, wow. i mean, well what are you going to major in? what are you going to do?",Ses04F
Ses04M_impro07_F006,hap,right.,Ses04F
Ses04M_impro07_F007,hap,yes.,Ses04F
Ses04M_impro07_F008,hap,is u.s.c. known for its history program?,Ses04F
Ses04M_impro07_F009,hap,i know. it's a great school and you know,Ses04F
Ses04M_impro07_F010,hap,it's all about the connections,Ses04F
Ses04M_impro07_F011,hap,"oh, you did not just say that.",Ses04F
Ses04M_impro07_F012,hap,i know. you're going to be so close.,Ses04F
Ses04M_impro07_F013,hap,i'm glad you did.,Ses04F
Ses04M_impro07_F014,hap,"that's great. i mean, i'm really glad you're not going to go anywhere. you'll still be here.",Ses04F
Ses04M_impro07_F015,hap,everything in la is twenty minutes away.,Ses04F
Ses04M_impro07_F016,hap,give or take. [laughter],Ses04F
Ses04M_impro07_F017,hap,well congratulations.,Ses04F
Ses04M_impro07_F018,hap,yeah.,Ses04F
Ses04M_impro07_F022,hap,"but, congrats on the u.s.c. thing.",Ses04F
Ses04M_impro07_F023,neu,"the -- what, the- i mean--",Ses04F
Ses04M_impro07_F026,neu,"okay. well that's cool, too, but like--",Ses04F
Ses04M_impro07_F027,hap,"wow, you are a winner and a half. [laughter]",Ses04F
Ses04M_impro07_F036,neu,excuse me?,Ses04F
Ses04M_impro07_F037,neu,no.,Ses04F
Ses04M_impro07_M000,hap,"alright, so you're not going to believe this. but i went home today. i looked through the mail. and i got an acceptance letter from u.s.c..",Ses04M
Ses04M_impro07_M001,hap,i'm going to u.s.c.. yeah.,Ses04M
Ses04M_impro07_M002,hap,"yeah, yeah.",Ses04M
Ses04M_impro07_M003,hap,"i did. i did. i've -- yeah, i applied to u.s.c.. i mean, it's really expensive but",Ses04M
Ses04M_impro07_M004,hap,it's a really good school. so,Ses04M
Ses04M_impro07_M007,hap,"yeah. i like to know about history, 'cause, you know, it's- it's just so relevant to the present.",Ses04M
Ses04M_impro07_M008,hap,yeah.,Ses04M
Ses04M_impro07_M009,hap,"and, uh-",Ses04M
Ses04M_impro07_M010,hap,"um, you know, i don't think so. but i think that, you know, it's still a private school",Ses04M
Ses04M_impro07_M011,hap,"and right you know it's still- and then, you know, i mean-",Ses04M
Ses04M_impro07_M012,hap,"i'm guessing, you know it's like i i checked it out. and, like, they have a decent history program.",Ses04M
Ses04M_impro07_M013,hap,"so -- and like the geology just is awesome. it rocks, no pun intended. [laughter]",Ses04M
Ses04M_impro07_M014,hap,"um, but, uh- anyway -- yeah, so that's awesome, though, because you live here and then we're not going to be separated by me going to some other school",Ses04M
Ses04M_impro07_M015,hap,"and, uh, it's just really exciting. i- you know, i'm -- just i want to- i want to share this special happy moment with you. it's awesome",Ses04M
Ses04M_impro07_M020,hap,"umm, and i'm going to check out school and get, you know, check out the courses",Ses04M
Ses04M_impro07_M021,hap,find out all this stuff. and- and i don't know. i think i'm going to try to live in a dorm.,Ses04M
Ses04M_impro07_M025,neu,"ouch. that's, um -- oh, wow.",Ses04M
Ses04M_impro07_M026,neu,"no, no, i mean, i didn't know -- i didn't know that about you. um, i feel like --",Ses04M
Ses04M_impro07_M029,neu,i'll go to basketball games.,Ses04M
Ses04M_impro07_M030,neu,maybe some golf matches.,Ses04M
Ses04M_impro07_M032,neu,i don't know. do they have golf? do they have- does u.s.c. have a -- i don't know if they have a golf team.,Ses04M
Ses04M_impro07_M035,neu,"no, i'm not going to go to a football game.",Ses04M
Ses04M_impro07_M036,neu,forget it. forget it. forget it. no way.,Ses04M
Ses04M_impro07_M037,neu,i do -- i will need to get a gun-,Ses04M
Ses04M_impro07_M040,neu,"okay. um, but, no, i, uh, i do need to get a gun soon, though, 'cause i mean",Ses04M
Ses04M_impro07_M041,neu,i need to get like a -- just a small little gun just 'cause -- or like a taser or something or just like a butterfly knife,Ses04M
Ses04M_impro07_M042,neu,"'cause, you know, i mean, it's like if i ever want to go south of campus",Ses04M
Ses04M_impro07_M043,neu,well i need to defend myself from,Ses04M
Ses04M_impro08_F020,neu,you're just going to put it back on my account.,Ses04F
Ses04M_impro08_F022,hap,"oh, my god, thank you so much.",Ses04F
Ses04M_impro08_F023,hap,"i really appreciate this. i know it's not policy or whatever but, seriously",Ses04F
Ses04M_impro08_F024,hap,make my life a lot easier.,Ses04F
Ses04M_impro08_F027,neu,i'll,Ses04F
Ses04M_impro08_F028,neu,"call up the sprint call center and, uh, you know. cool",Ses04F
Ses04M_impro08_F030,neu,you too.,Ses04F
Ses04M_impro08_M001,neu,are you sure you didn't make them?,Ses04M
Ses04M_impro08_M004,neu,okay.,Ses04M
Ses04M_impro08_M005,neu,"umm, miss aruckman",Ses04M
Ses04M_impro08_M006,neu,i am seeing the two hundred dollar charge.,Ses04M
Ses04M_impro08_M008,neu,so you're saying that you didn't make these calls.,Ses04M
Ses04M_impro08_M010,neu,all i can do for you right now is give you a hundred dollars.,Ses04M
Ses04M_impro08_M011,neu,what i can,Ses04M
Ses04M_impro08_M012,neu,what i can do for you is give you a hundred dollars right now and fill out complaint form,Ses04M
Ses04M_impro08_M013,neu,which you- which you'll have to go into a local verizon dealer-- or sprint.,Ses04M
Ses04M_impro08_M017,neu,a few weeks. you won't even know that they were there.,Ses04M
Ses04M_impro08_M019,neu,"yeah. that's fine. i just -- that's fine. yeah, i mean, it doesn't make any difference to me. i mean, it's not like it's going to cost my job or anything.",Ses04M
Ses04M_impro08_M020,neu,"i mean, technically, that's policy. but, like, i mean, i don't really care about -- nobody really cares about policy here.",Ses04M
Ses04M_impro08_M021,neu,sure.,Ses04M
Ses04M_impro08_M022,neu,you're welcome.,Ses04M
Ses04M_impro08_M023,neu,"no, no, no, it's cool. it's cool. it's cool. so, um",Ses04M
Ses04M_impro08_M024,neu,"you know, so- i mean, are you doing anything later? or um",Ses04M
Ses04M_impro08_M025,neu,"oh, i don't know. i mean, i don't know. i just thought, you know, maybe you want to get some co--i mean, i'm actually -- wait, where do you live? oh, you're in los angeles, i see. oh, no, that sucks 'cause i'm in, actually in alabama.",Ses04M
Ses04M_impro08_M026,neu,"god, that's like a whole problem with like-- but, no, i mean, hey-- if you ever",Ses04M
Ses04M_impro08_M027,neu,"if you ever come out to montgomery, i mean, you know, just -- just call up, you know, call up the operator and i'll-- i'll be here. so, um.",Ses04M
Ses04M_impro08_M028,neu,alright. take care.,Ses04M
Ses04M_script01_1_F000,neu,what's he going to say? maybe we ought to tell him before he sees it.,Ses04F
Ses04M_script01_1_F007,sad,he's getting just like after he died. what's the meaning in that?,Ses04F
Ses04M_script01_1_F011,ang,you can't say that to him.,Ses04F
Ses04M_script01_1_F012,ang,how are you going to prove it? can you prove it?,Ses04F
Ses04M_script01_1_F013,ang,"to you it is and to me, but not to him. you can talk yourself blue in the face, but there's no body and no grave, so where are you?",Ses04F
Ses04M_script01_1_F015,neu,why?,Ses04F
Ses04M_script01_1_F017,neu,"well that's only your business, chris.",Ses04F
Ses04M_script01_1_F018,ang,what do you want me to do? you're old enough to know your own mind.,Ses04F
Ses04M_script01_1_F019,neu,well you want to make sure your father isn't going to have --,Ses04F
Ses04M_script01_1_F021,ang,i ignore what i got to ignore. the girl is larry's girl.,Ses04F
Ses04M_script01_1_F022,ang,"from father's point of view, he's not dead. and you have no right to take his girl.",Ses04F
Ses04M_script01_1_F027,neu,how do you know she'll marry you? maybe she feels the same way father does.,Ses04F
Ses04M_script01_1_F028,neu,"the trouble is, you don't see enough women. you never did.",Ses04F
Ses04M_script01_1_F029,ang,i don't see why it has to be annie.,Ses04F
Ses04M_script01_1_F032,neu,yes we did. do you want to keep going?,Ses04F
Ses04M_script01_1_F033,neu,just give it some more thought.,Ses04F
Ses04M_script01_1_F034,ang,what the hell is this?,Ses04F
Ses04M_script01_1_F035,ang,are you crazy?,Ses04F
Ses04M_script01_1_F036,ang,you've got a business here. what the hell is this?,Ses04F
Ses04M_script01_1_F037,ang,must you be inspired?,Ses04F
Ses04M_script01_1_F039,ang,you don't want to think like that.,Ses04F
Ses04M_script01_1_F040,ang,"alright. but just don't think like that because what the hell did we work for? that's all for you, chris. the whole shooting match is just for you.",Ses04F
Ses04M_script01_1_F041,ang,"but don't think that way, you hear me?",Ses04F
Ses04M_script01_1_M000,neu,he saw it.,Ses04M
Ses04M_script01_1_M001,neu,he was out here when it broke.,Ses04M
Ses04M_script01_1_M013,ang,we've gotta say it to him.,Ses04M
Ses04M_script01_1_M014,ang,"for god's sake, three years. nobody comes back after three years. it's insane.",Ses04M
Ses04M_script01_1_M018,neu,going to ask her to marry me.,Ses04M
Ses04M_script01_1_M021,ang,"well, then you know it's not only my business.",Ses04M
Ses04M_script01_1_M022,ang,"sometimes you infuriate me, you know that? isn't it your business, too, if i tell this to father and he throws a fit about it? you have such a talent for ignoring things.",Ses04M
Ses04M_script01_1_M026,neu,i wanted to get this settled first.,Ses04M
Ses04M_script01_1_M031,neu,"alright, then, mom. did we skip something? no. alright, then, mom.",Ses04M
Ses04M_script01_1_M032,neu,"yeah, let's keep going.",Ses04M
Ses04M_script01_1_M034,sad,"father forgot about larry, we'd have a regular wedding and everything happy. if i can't get that here, then i'll have to get out.",Ses04M
Ses04M_script01_1_M037,ang,the business? the business doesn't inspire me.,Ses04M
Ses04M_script01_1_M038,ang,"yes. i like getting an hour a day. if i have to grub for money all day long, at least at evening, i want it beautiful.",Ses04M
Ses04M_script01_1_M040,neu,"yes, on this i would.",Ses04M
Ses04M_script01_1_M041,neu,then you help me stay here.,Ses04M
Ses04M_script01_2_F000,ang,why did he invite her here?,Ses04F
Ses04M_script01_2_F001,neu,why does that bother you?,Ses04F
Ses04M_script01_2_F002,ang,"she's been in new york three and a half years. why, all of a sudden--",Ses04F
Ses04M_script01_2_F003,ang,nobody comes seven hundred miles just to see.,Ses04F
Ses04M_script01_2_F004,ang,he's not going to marry her.,Ses04F
Ses04M_script01_2_F005,ang,it's got that about it.,Ses04F
Ses04M_script01_2_F006,ang,"what's going on here, joe?",Ses04F
Ses04M_script01_2_F007,neu,"now listen, kid. now, listen.",Ses04F
Ses04M_script01_2_F008,ang,"she's not his girl, joe. she knows she's not.",Ses04F
Ses04M_script01_2_F009,ang,"then why is she still single? new york is full of men. why hasn't she married? probably a hundred people told her she's foolish, but she's waited.",Ses04F
Ses04M_script01_2_F010,ang,"because she knows what i know, that's why. she's faithful as a rock. in my worst moments, i think of her waiting and i know, again, that i'm right.",Ses04F
Ses04M_script01_2_F011,ang,"nobody in this house dares take her faith away, joe. strangers might, but not his father, not his brother.",Ses04F
Ses04M_script01_2_F012,ang,"i want you to act like he's coming back, both of you. don't think i haven't noticed you since he invited her here. i won't stand for any nonsense.",Ses04F
Ses04M_script01_2_F013,ang,"because if he's not coming back, i'll kill myself.",Ses04F
Ses04M_script01_2_F014,ang,laugh. laugh at me. but why did that happen the very night that she came here?,Ses04F
Ses04M_script01_2_F015,ang,she goes to sleep in his bed and his memorial breaks in pieces. look. look at it. joe--,Ses04F
Ses04M_script01_2_F016,ang,"believe with me, joe. i can't stand all alone",Ses04F
Ses04M_script01_2_F018,ang,"you, above all, have got to believe. you.",Ses04F
Ses04M_script01_2_F020,sad,i can't help it.,Ses04F
Ses04M_script01_2_M000,neu,"oh, god, line.",Ses04M
Ses04M_script01_2_M005,neu,how do you know he's even thinking about it?,Ses04M
Ses04M_script01_2_M006,neu,well so what?,Ses04M
Ses04M_script01_2_M007,neu,line.,Ses04M
Ses04M_script01_2_M019,ang,"what have i got to hide? what the hell is the matter with you, kate?",Ses04M
Ses04M_script01_3_F012,hap,every day since.,Ses04F
Ses04M_script01_3_F013,hap,"i was waiting for you, chris. 'til then, you never wrote and when you did, what did you say? you sure can be ambiguous, you know.",Ses04F
Ses04M_script01_3_F014,hap,i'll never forgive you. why did you wait all these years? all i've done is sit around and wonder if i was crazy for thinking of you.,Ses04F
Ses04M_script01_3_F022,sad,how many?,Ses04F
Ses04M_script01_3_F023,sad,"oh, gees.",Ses04F
Ses04M_script01_3_F027,hap,what'll i do with a fortune?,Ses04F
Ses04M_script01_3_M022,sad,"yes, i suppose there has been. but it's going from me.",Ses04M
Ses04M_script01_3_M023,sad,i don't know where to start.,Ses04M
Ses04M_script01_3_M024,sad,"it's all mixed up with so many other things. you remember overseas, i was in command of a company?",Ses04M
Ses04M_script01_3_M025,sad,well i lost them.,Ses04M
Ses04M_script01_3_M026,sad,just about all.,Ses04M
Ses04M_script01_3_M027,sad,it takes a little time to toss that off because they weren't just men.,Ses04M
Ses04M_script01_3_M028,sad,"for instance, one time it'd been raining several days. and this kid came to me and gave me his last pair of dry socks; put them in my pocket. that's only a little thing, but that's the kind of guys i had.",Ses04M
Ses04M_script01_3_M030,sad,"and i got this idea watching them go down, everything was being destroyed, see? but, to me, it seemed there was one new thing that was made,",Ses04M
Ses04M_script01_3_M031,sad,a kind of responsibility. man for man. you understand me? and then i went home and it was incredible.,Ses04M
Ses04M_script01_3_M032,sad,"there was no meaning in it here. the whole thing to them was some sort of bus accident. then i went to work for dad and that whole rat race again. i felt, what you said, ashamed somehow",Ses04M
Ses04M_script01_3_M033,sad,because nobody was changed. it seemed to make suckers out of a lot of guys. i felt wrong to be alive;,Ses04M
Ses04M_script01_3_M034,sad,"to open that bank book; to drive the new car; to see the new refrigerator. i mean, you can take these things out of a war, but when you drive the new car, you have to know that it came out of the love a man can have for a man.",Ses04M
Ses04M_script01_3_M035,sad,"you have to be a little better because of that. otherwise, we have is really loot and there's blood on it. i don't want to take any of it. i guess that included you.",Ses04M
Ses04M_script01_3_M037,hap,"annie, annie, i'm going to make you a fortune.",Ses04M
Ses04M_script02_1_F000,neu,fine.,Ses04F
Ses04M_script02_1_F002,ang,it's not yours.,Ses04F
Ses04M_script02_1_F003,ang,"it's ours. it's mine, too.",Ses04F
Ses04M_script02_1_F004,ang,you kept saying my flashlight as if it's somehow just yours. how is that supposed to make me feel?,Ses04F
Ses04M_script02_1_F005,ang,yes.,Ses04F
Ses04M_script02_1_F007,ang,it's after eleven; let's go home.,Ses04F
Ses04M_script02_1_F008,ang,there is no point in coming down here.,Ses04F
Ses04M_script02_1_F010,ang,so let's go home.,Ses04F
Ses04M_script02_1_F012,ang,i just don't. it's stupid.,Ses04F
Ses04M_script02_1_F013,ang,"pass up what? these little fish swim onto the beach, flop around and then they swim away. and then they die.",Ses04F
Ses04M_script02_1_F014,neu,what are you so excited about?,Ses04F
Ses04M_script02_1_F017,ang,yes.,Ses04F
Ses04M_script02_1_F018,ang,"last year, you will also remember, our shoes got wet. i got sand in my panties. we got into a big fight over nothing. you got a sore throat and we did not see the grunions.",Ses04F
Ses04M_script02_1_M001,hap,"actually, i wanted to go a little farther up the coast, get away from the lights and the people, but i was afraid we'd miss it. how you doing?",Ses04M
Ses04M_script02_1_M002,hap,"is that, is that - is that just foam? i can't even tell. although, if you can't tell, it's probably isn't them. it'll probably be unmistakable, don't you think?",Ses04M
Ses04M_script02_1_M003,hap,"how you doing? oh, no, you know what i did? i forgot to bring my flashlight. how could i be so stupid? i should have brought my flashlight.",Ses04M
Ses04M_script02_1_M005,neu,whose is it?,Ses04M
Ses04M_script02_1_M008,hap,"i wonder, do they always run during a full moon? i can't remember if it was full last year. remember?",Ses04M
Ses04M_script02_1_M009,neu,"are you cold? do you want my jacket? we should have brought the blanket, our blanket.",Ses04M
Ses04M_script02_1_M012,neu,you want my jacket?,Ses04M
Ses04M_script02_1_M014,neu,right.,Ses04M
Ses04M_script02_1_M015,neu,"that's my point, too.",Ses04M
Ses04M_script02_1_M018,hap,"honey, this is a natural phenomenon. i mean, this only happens once a year. it's a great opportunity. think about the people in kansas. they'd have to get plane tickets and hotel reservations to come see this. we're just forty minutes away. it's too good to pass up.",Ses04M
Ses04M_script02_1_M020,hap,there's mystery here and magic.,Ses04M
Ses04M_script02_1_M021,hap,"oh, it's a big night for these guys. uh, life's last orgy.",Ses04M
Ses04M_script02_1_M022,hap,"yeah, they do. okay. but it's fish who do something none of the other fish do; like the swallows are returning to capistrano; or the lemmings throwing themselves off the cliffs, like that.",Ses04M
Ses04M_script02_1_M023,hap,there's mystery here and magic; a little bit of the unexplainable. i don't see how you can not be interested.,Ses04M
Ses04M_script02_1_M028,hap,"no, it's just seaweed, isn't it? oh, man, this is great. i wouldn't miss this for anything. i mean, think about this. i know you're not interested, but just think about this for a minute.",Ses04M
Ses04M_script02_1_M029,hap,out there someplace is this huge mass of silver fish heading this way. they don't know why. we don't know why. it wasn't a decision. they didn't take a vote. no one sent them an invitation or a map;,Ses04M
Ses04M_script02_1_M030,hap,"just some little instinctual time release firecracker went off in their little bodies and all as one, they turned and formed a line as long as the california coast and started swimming.",Ses04M
Ses04M_script02_1_M031,hap,they're swimming right now as if that's the only thing that matters. it's single mindedness with no mind. urgency that's pure urge.,Ses04M
Ses04M_script02_1_M032,hap,"they don't know what drives them. they don't give it a name or ask a question. they just turn, as one, and start the swim that brings them here; to this place, where we stand, for a massive celebration of sex and death. oh, man, i'm giving myself goose bumps. all my hairs are popping up.",Ses04M
Ses04M_script02_1_M033,hap,well so what did you think?,Ses04M
Ses04M_script02_2_F000,neu,"look at this, goose bumps.",Ses04F
Ses04M_script02_2_F006,ang,"goddamn it, augie, don't ask me that. i hate it when you ask me that. you always ask me that. it's insulting.",Ses04F
Ses04M_script02_2_F007,ang,we just have different ideas about what this evening is supposed to look like.,Ses04F
Ses04M_script02_2_F009,ang,"we never do, do we? have we ever?",Ses04F
Ses04M_script02_2_F013,ang,"i did want to see it. i always do. i keep thinking this time will be the time, but it never is.",Ses04F
Ses04M_script02_2_F016,sad,"it was about four years ago, right after we got married. we thought i was pregnant and we had a bottle of champagne but no glasses. you asked me to dance. so we took off our shoes and you popped the cork.",Ses04F
Ses04M_script02_2_F018,sad,dancing barefoot in the sand; drinking champagne from the bottle.,Ses04F
Ses04M_script02_2_F019,sad,i'd rather not remember some things. i'd rather not hope for some things.,Ses04F
Ses04M_script02_2_F020,sad,no.,Ses04F
Ses04M_script02_2_F021,sad,no.,Ses04F
Ses04M_script02_2_F025,ang,no.,Ses04F
Ses04M_script02_2_F026,ang,i want something to turn out the way it's supposed to.,Ses04F
Ses04M_script02_2_F027,ang,this what? what is this? this isn't even anything.,Ses04F
Ses04M_script02_2_F028,ang,"oh, right, sure. this is standing on the beach. this is waiting. this is fighting.",Ses04F
Ses04M_script02_2_F029,ang,but this isn't anything like i thought anything would be like.,Ses04F
Ses04M_script02_2_F032,sad,i didn't say that.,Ses04F
Ses04M_script02_2_F035,hap,"okay, fine. so we're in the wrong spot, but we're with the right person.",Ses04F
Ses04M_script02_2_F036,hap,"yeah, i noticed that. looks pretty on the water, doesn't it? big ol' white moon. i'm sorry, augie.",Ses04F
Ses04M_script02_2_M000,neu,well so what'd you think?,Ses04M
Ses04M_script02_2_M001,neu,what i said.,Ses04M
Ses04M_script02_2_M006,ang,well what's bugging you?,Ses04M
Ses04M_script02_2_M007,ang,"there's nothing to it. we come down here. the grunions arrive. they do their little fish business. we go ooh, ah, look at the fish. they go home. we go home.",Ses04M
Ses04M_script02_2_M020,neu,"wait a minute, i've got it.",Ses04M
Ses04M_script02_2_M021,neu,"it was in the car, right? driving past the knickerbocker liquor locker? you said let's get some champagne and i said times a wasting or something like that. right? that's it, right? you want this to be like the other time. that's it. of course.",Ses04M
Ses04M_script02_2_M029,ang,"well welcome to the human race. you think this is what i had in mind? you think that when i proposed, i had this great fantasy going that four years down the line, we'd come to the beach and yell at each other over fish? no.",Ses04M
Ses04M_script02_2_M031,ang,"and we'll have three fat rosy kids and ha, ha, ha, baby, the joke's on us, 'cause you know what you get, carla? you know what you get? this.",Ses04M
Ses04M_script02_2_M034,ang,"no, i know, me neither.",Ses04M
Ses04M_script02_2_M037,sad,"no, i know. but still. i know i don't make you happy.",Ses04M
Ses04M_script02_2_M039,hap,"actually, now that you mention it, no. i don't.",Ses04M
Ses04M_script02_2_M040,hap,"i don't know. it seemed like a good spot to me. i mean, look at the view you've got of the moon from here.",Ses04M
Ses04M_script02_2_M041,hap,"shh. if we're very quiet, the fish might come.",Ses04M
Ses04M_script03_1_F005,hap,"oh, it sent shivers up my spine.",Ses04F
Ses04M_script03_1_F006,hap,behave exquisitely.,Ses04F
Ses04M_script03_1_F007,hap,certainly. i shall probably do a court curtsey.,Ses04F
Ses04M_script03_1_F008,hap,but what's so horrible is that one can't stay happy.,Ses04F
Ses04M_script03_1_F009,hap,it's true. the whole business is a very poor joke.,Ses04F
Ses04M_script03_1_F012,hap,who's they?,Ses04F
Ses04M_script03_1_F013,neu,"if i laugh at everything, i must laugh at us, too.",Ses04F
Ses04M_script03_1_F014,hap,"how long will it last, this ludicrous and overbearing love of ours?",Ses04F
Ses04M_script03_1_F015,hap,shall we always want to bicker and fight?,Ses04F
Ses04M_script03_1_F017,hap,"what happens if one of us dies? does the one that's left, still laugh?",Ses04F
Ses04M_script03_1_F018,hap,"well that's serious enough, isn't it?",Ses04F
Ses04M_script03_1_F021,hap,"thank you, dear. the same applies to you, except that if i catch you so much as looking at another woman, i will kill you.",Ses04F
Ses04M_script03_1_F022,hap,which particular one?,Ses04F
Ses04M_script03_1_F023,hap,"oh, charles; that was his name, charles. oh, he did wriggle so beautifully.",Ses04F
Ses04M_script03_1_F024,hap,i know you did. you threw it out of the window into the grand canal. i don't think i'll ever forgive you for that.,Ses04F
Ses04M_script03_1_F025,hap,it went on intermittently for days.,Ses04F
Ses04M_script03_1_F026,hap,"it burnt my comb, too, and all the towels in the bathroom.",Ses04F
Ses04M_script03_1_F027,hap,that was the first time you ever hit me.,Ses04F
Ses04M_script03_1_F028,hap,"the manager came in and found is rolling about on the floor, biting and scratching like panthers. oh, dear.",Ses04F
Ses04M_script03_1_F029,hap,"how ridiculous. how utterly, utterly ridiculous.",Ses04F
Ses04M_script03_1_F030,hap,and very much sillier.,Ses04F
Ses04M_script03_1_M003,neu,"we'll be alright, darling. whatever happens, aren't we?",Ses04M
Ses04M_script03_1_M004,hap,"i don't care, then.",Ses04M
Ses04M_script03_1_M006,hap,what shall we do if they suddenly walk in on us?,Ses04M
Ses04M_script03_1_M007,hap,with the mo- with the most perfect poise?,Ses04M
Ses04M_script03_1_M010,neu,"meaning that sacred and beautiful thing, love?",Ses04M
Ses04M_script03_1_M012,neu,"you mustn't be serious, my dear. that's just what they want.",Ses04M
Ses04M_script03_1_M013,ang,all the futile moralists who try to make life unbearable. laugh at them. be flippant. laugh at everything. all their sacred shibboleths. flippancy brings out the acid- acid in their damn sweetness and light.,Ses04M
Ses04M_script03_1_M016,sad,no. that fire will fade along with our passion.,Ses04M
