file,emotion,text,speaker
Ses02F_script01_3_M030,sad,"you know what i mean? to show that, to bring that onto the earth again, like some kind of monument and everyone would feel it standing behind him and it would make a difference to him.",Ses02M
Ses02F_script01_3_M031,sad,then i came back and it was incredible. there was no meaning in it here. the whole thing to them seemed like sort of a bus accident. i went to work with dad and that rat race again.,Ses02M
Ses02F_script01_3_M032,sad,"and i felt what you said, ashamed somehow 'cause nobody was changed at all. it seemed to make suckers out of a lot of guys. i felt wrong to be alive to open the new bank book, drive the new car, see the new refrigerator.",Ses02M
Ses02F_script01_3_M033,sad,"i mean, you can take those things out of a war, but when you drive that car, you've gotta know that it came out of the love a man can have for a man. you've gotta be a little better because of it.",Ses02M
Ses02F_script01_3_M034,sad,because otherwise all you have is really loot and there's blood on it. and i didn't want to take any of it. and i guess that included you.,Ses02M
Ses02F_script02_1_F001,neu,what flashlight?,Ses02F
Ses02F_script02_1_F005,neu,yeah.,Ses02F
Ses02F_script02_1_F019,neu,we didn't see them the first time either.,Ses02F
Ses02F_script02_1_F021,neu,about what?,Ses02F
Ses02F_script02_1_M000,hap,what time is it? they're supposed to run around midnight.,Ses02M
Ses02F_script02_1_M001,hap,"this is great, isn't it? look at the night we've got here, couldn't be better.",Ses02M
Ses02F_script02_1_M002,hap,"i would have liked to have gone a little further up the coast to get away from the lights and the people, but i was afraid we'd miss it.",Ses02M
Ses02F_script02_1_M003,hap,how you doing?,Ses02M
Ses02F_script02_1_M004,hap,is that--no--is that just foam? i can't even tell.,Ses02M
Ses02F_script02_1_M005,hap,"well, i guess we can tell, it probably isn't right? probably be unmistakable don't you think?",Ses02M
Ses02F_script02_1_M006,hap,"how you doing? aw, you know what i forgot? i forgot to bring my flashlight. oh, how could i be so stupid? i should've brought my flashlight.",Ses02M
Ses02F_script02_1_M009,neu,"oh, well sure.",Ses02M
Ses02F_script02_1_M010,neu,"right, of course. our flashlight. mine and yours. i mean, me flashlight is su flashlight naturally.",Ses02M
Ses02F_script02_1_M012,neu,"i wonder, do they always run during a full moon? i can't remember if it was full last year. do you remember?",Ses02M
Ses02F_script02_1_M013,neu,"you cold? do you want my jacket? oh, we should've brought the blanket. our blanket.",Ses02M
Ses02F_script02_1_M014,hap,"this is great, isn't it? a six pack would be just the ticket right now.",Ses02M
Ses02F_script02_1_M015,hap,i can't believe i forgot. i'm like a kid. it's amazing i got out of the house with my fly zipped.,Ses02M
Ses02F_script02_1_M016,hap,you think they can hear us talk? or feel the vibrations in the sand when we move around?,Ses02M
Ses02F_script02_1_M017,neu,do you want my jacket?,Ses02M
Ses02F_script02_1_M019,neu,right.,Ses02M
Ses02F_script02_1_M020,neu,that's my point too.,Ses02M
Ses02F_script02_1_M021,neu,no. no. that's not my point. the point is there's no point in coming down if we just leave. don't you want to see it?,Ses02M
Ses02F_script02_1_M024,hap,"think about the people in kansas, they had to get plane tickets and hotel reservations to see this. we live forty minutes away. it's too good to pass up.",Ses02M
Ses02F_script02_1_M025,hap,"yeah, but that moment on the beach, is the highlight of their little lives. all that flopping is laying eggs or what do you--spawning or mating. i mean,",Ses02M
Ses02F_script02_1_M026,hap,this is a big night for these guys. life's last orgy.,Ses02M
Ses02F_script02_1_M028,hap,alright. but it's fish that do something that none of the other fish do. like the swallows returning to capistrano or the lemmings throwing themselves off the cliffs.,Ses02M
Ses02F_script02_1_M031,neu,"i don't get it. the first time we came here, you said it was the best night of your life.",Ses02M
Ses02F_script02_1_M033,neu,we weren't in a good spot.,Ses02M
Ses02F_script02_1_M035,hap,there is that--no that's just seaweed isn't it?,Ses02M
Ses02F_script02_1_M036,hap,"oh man, this is great, isn't it? i wouldn't miss this for anything. here, think about this, all right, i know you're not interested, but think about this.",Ses02M
Ses02F_script02_1_M039,hap,"all as one, this time release instinctual little firecracker went off and they all turned and formed a line as long as the california coast and started swimming. and they're swimming right now as if that's all that matters.",Ses02M
Ses02F_script02_1_M040,hap,it's like single mindedness with no mind. it's urgency that's pure urge. they don't know what drives them. they don't ask it a question or give it a name.,Ses02M
Ses02F_script02_1_M041,hap,"they just turn as one and start the swim that brings them right here to where we stand, for a massive celebration of sex and death.",Ses02M
Ses02F_script02_1_M042,hap,"ah, god, i'm giving myself goose bumps. look, all my hairs are popped up.",Ses02M
Ses02F_script02_1_M043,neu,"well, so what do you think?",Ses02M
Ses02F_script02_1_M044,neu,what i was saying.,Ses02M
Ses02F_script02_2_F000,neu,about what?,Ses02F
Ses02F_script02_2_F005,ang,"god damn it, augie, don't ask me that. i hate it when you ask me that. you always ask me that. it's insulting.",Ses02F
Ses02F_script02_2_F006,ang,we just have different ideas of what this evening is supposed to look like.,Ses02F
Ses02F_script02_2_F011,ang,"i mean, i feel like my whole life is gonna be spent standing on the beach with my eyes wide open and my hands clasped expectantly waiting for the fish to show up. and the fish won't show up.",Ses02F
Ses02F_script02_2_F015,sad,"do you remember the first time we came to see it? it was about four years ago, right after we got married.",Ses02F
Ses02F_script02_2_F016,sad,"i thought i was pregnant, you had a bottle of champagne, but no glasses. you asked me to dance, so we kicked off our shoes and you popped the cork.",Ses02F
Ses02F_script02_2_F017,sad,"and while we were dancing, you said the softest, most intimate things to me right into my ear so that i could feel them as much as hear them.",Ses02F
Ses02F_script02_2_F018,sad,"and i remember thinking, this is it. you know, at last--at last i am as happy as i am supposed to be.",Ses02F
Ses02F_script02_2_F019,sad,"just dancing barefoot in the sand, drinking champagne out of the bottle.",Ses02F
Ses02F_script02_2_F020,sad,i'd rather not remember some things. i would rather not hope for some things.,Ses02F
Ses02F_script02_2_F021,sad,no.,Ses02F
Ses02F_script02_2_F022,sad,no.,Ses02F
Ses02F_script02_2_F024,sad,no.,Ses02F
Ses02F_script02_2_F031,sad,well. this isn't anything like i thought anything would be like.,Ses02F
Ses02F_script02_2_F033,sad,"i know that, augie. really, i do.",Ses02F
Ses02F_script02_2_F034,sad,"i know that you meant this to be special and nice and the sand and the moon and all, but i just couldn't help thinking about being somewhere else.",Ses02F
Ses02F_script02_2_F035,sad,i didn't say that.,Ses02F
Ses02F_script02_2_F038,sad,you're the one who probably wishes you were with someone else. someone who--you'd rather enjoy yourself and didn't take everything so hard.,Ses02F
Ses02F_script02_2_F041,hap,"augie, you brought refreshments.",Ses02F
Ses02F_script02_2_F042,hap,"well, then we don't need glasses.",Ses02F
Ses02F_script02_2_F043,hap,no. i think you might be right. maybe this is the spot after all.,Ses02F
Ses02F_script02_2_F044,sad,"augie, i'm sorry.",Ses02F
Ses02F_script02_2_F045,hap,or not.,Ses02F
Ses02F_script02_2_M000,hap,"well, so what do you think?",Ses02M
Ses02F_script02_2_M001,neu,what i was saying.,Ses02M
Ses02F_script02_2_M002,neu,it certainly is not. it's slightly exaggerated scientific fact.,Ses02M
Ses02F_script02_2_M003,neu,"well, i'm not the only one. look at all these people.",Ses02M
Ses02F_script02_2_M005,neu,"carla, can i ask you something? don't take this wrong, but are you having your period?",Ses02M
Ses02F_script02_2_M007,neu,"there's nothing to it. we come here, the grunion arrive, they do their little fish business, we go ooh, ah, look at the fish. they go home. we go home.",Ses02M
Ses02F_script02_2_M009,neu,we've missed them twice. that's not ever.,Ses02M
Ses02F_script02_2_M010,neu,"well, we'll see them this year.",Ses02M
Ses02F_script02_2_M013,neu,it's just fish. nothing to get traumatized about.,Ses02M
Ses02F_script02_2_M016,neu,"you said, ""hey the grunion are running tonight."" i said, ""great, let's go. i feel lucky.""",Ses02M
Ses02F_script02_2_M017,neu,"okay, so i'm putting on my jacket, putting out the animals, getting the car out of the garage--",Ses02M
Ses02F_script02_2_M018,neu,wait a minute. i've got it.,Ses02M
Ses02F_script02_2_M019,neu,"it was in the car, right? driving past the knickerbocker liquor locker, you said, ""let's get some champagne,"" and i said, ""time's a wasting"" or something like that, right?",Ses02M
Ses02F_script02_2_M020,neu,"yeah, of course, i see it now. you want this to be like that other time, right? that's it, right?",Ses02M
Ses02F_script02_2_M021,neu,"okay, yeah, sure, i see it now. listen, you wanna dance?",Ses02M
Ses02F_script02_2_M022,neu,you want me to go get some champagne?,Ses02M
Ses02F_script02_2_M023,neu,take off our shoes?,Ses02M
Ses02F_script02_2_M029,ang,"well, welcome to the human race. do you think this is what i had in mind when i proposed? that four years down the road, we'd be at the beach yelling at each other over fish?",Ses02M
Ses02F_script02_2_M031,sad,"no, carla, i'm just like you. i thought it was gonna be all peaches and roses and sand in our toes and wind in our hair and the fish will always come and the bills will pay themselves and we'll have three fat rosy kids and ha, ha, baby, the joke's on us",Ses02M
Ses02F_script02_2_M033,neu,"yes, it is.",Ses02M
Ses02F_script02_2_M034,neu,right.,Ses02M
Ses02F_script02_2_M035,sad,"i know, me neither.",Ses02M
Ses02F_script02_2_M036,sad,i'm doing the best i can.,Ses02M
Ses02F_script02_2_M037,sad,maybe if you were with somebody else too.,Ses02M
Ses02F_script02_2_M038,sad,"no, i know. but still. i know i don't make you happy.",Ses02M
Ses02F_script02_2_M041,hap,"i don't know. it seemed like a pretty good spot to me. i mean, look at the view you have of the moon from here.",Ses02M
Ses02F_script02_2_M042,hap,"well, look what we have here.",Ses02M
Ses02F_script02_2_M043,hap,it's not champagne.,Ses02M
Ses02F_script02_2_M045,hap,shh. if we're very quiet the fish might come.,Ses02M
Ses02F_script02_2_M046,hap,or not.,Ses02M
Ses02F_script03_1_F005,hap,"ah, it send shivers up my spine.",Ses02F
Ses02F_script03_1_F006,hap,behave exquisitely.,Ses02F
Ses02F_script03_1_F007,hap,"oh, of course. i shall probably do a court curtsy.",Ses02F
Ses02F_script03_1_F008,hap,what's so horrible is that one can't stay happy.,Ses02F
Ses02F_script03_1_F009,hap,it's true. the whole business is a very poor joke.,Ses02F
Ses02F_script03_1_F010,hap,"yes, meaning just that.",Ses02F
Ses02F_script03_1_F012,neu,who's they?,Ses02F
Ses02F_script03_1_F013,neu,"if i laugh at everything, then i must laugh at us too.",Ses02F
Ses02F_script03_1_F014,neu,"well how long will it last us, this ludicrous overbearing love of ours.",Ses02F
Ses02F_script03_1_F015,neu,"well, shall we always want to bicker and fight?",Ses02F
Ses02F_script03_1_F016,neu,"oh, dear, shall we like that?",Ses02F
Ses02F_script03_1_F017,neu,"well, what happens if one of us dies? i mean, does the one that's left still laugh?",Ses02F
Ses02F_script03_1_F019,hap,"darling, i believe you're talking nonsense.",Ses02F
Ses02F_script03_1_F020,hap,"elliott, worms don't pop.",Ses02F
Ses02F_script03_1_F021,hap,"oh, thank you, dear. the same applies to you except that if i catch so much as looking at another woman, i'll kill you.",Ses02F
Ses02F_script03_1_F022,hap,which particular one?,Ses02F
Ses02F_script03_1_F023,hap,charles. that was his name. charles. he did wriggle so beautifully.,Ses02F
Ses02F_script03_1_F024,hap,"yes, i know you did. you threw it out of the window into the grand canal. i don't think i'll ever forgive you for that.",Ses02F
Ses02F_script03_1_F025,hap,it went in intermittently for days.,Ses02F
Ses02F_script03_1_F026,hap,it burned my comb too and all the towels in the bathroom.,Ses02F
Ses02F_script03_1_F027,neu,that was the first time you ever hit me.,Ses02F
Ses02F_script03_1_F028,hap,"the manager came in and found us rolling around on the floor, biting and scratching like panthers.",Ses02F
Ses02F_script03_1_F029,hap,it was ridiculous. completely ridiculous.,Ses02F
Ses02F_script03_1_M001,neu,i wonder.,Ses02M
Ses02F_script03_1_M004,neu,i don't care then.,Ses02M
Ses02F_script03_1_M005,neu,hello? hello? what? wrong number.,Ses02M
Ses02F_script03_1_M007,neu,with the most perfect poise?,Ses02M
Ses02F_script03_1_M008,neu,things that ought to matter dreadfully don't matter at all when one's happy. do they?,Ses02M
Ses02F_script03_1_M009,neu,"oh, darling, don't say that.",Ses02M
Ses02F_script03_1_M010,neu,"meaning that sacred and beautiful thing, love?",Ses02M
Ses02F_script03_1_M012,neu,"you mustn't be serious, my dear one. that's just what they want.",Ses02M
Ses02F_script03_1_M013,neu,all those futile moralists that try to make life unbearable. laugh at them. be flippant. laugh at everything. all their sacred shibboleths.,Ses02M
Ses02F_script03_1_M014,neu,flippancy brings out the acid in their damn sweetness and light.,Ses02M
Ses02F_script03_1_M015,neu,"certainly, you must. we're figures of fun, alright.",Ses02M
Ses02F_script03_1_M016,neu,who knows.,Ses02M
Ses02F_script03_1_M017,neu,"no, that desire will fade. along with our passion.",Ses02M
Ses02F_script03_1_M018,neu,depends on how well we've played.,Ses02M
Ses02F_script03_1_M019,hap,yes. yes. with all his might.,Ses02M
Ses02F_script03_1_M020,hap,"no. no, it isn't. death is very laughable. such a cunning little mystery. all done with mirrors.",Ses02M
Ses02F_script03_1_M021,neu,so is everyone else in the long run.,Ses02M
Ses02F_script03_1_M022,hap,"let's be superficial and pity the poor philosophers. let's blow our trumpets and squeakers and enjoy the party as much as we can. like quite idiotic, very small school children. let's savor the delight of the moment.",Ses02M
Ses02F_script03_1_M023,hap,"come and kiss me, darling, before your body rots and worms pop in and out of your eye sockets.",Ses02M
Ses02F_script03_1_M024,neu,"i don't care what you do. see, you could paint yourself green and dance naked in the place vendome and rush off madly with all the men in the world and i shan't say a word. as long as you love me best.",Ses02M
Ses02F_script03_1_M025,neu,you remember that awful scene we had in venice?,Ses02M
Ses02F_script03_1_M026,neu,the one when you bought that little painted wooden snake in the piazza and put it on my bed.,Ses02M
Ses02F_script03_1_M028,neu,how long did that row last?,Ses02M
Ses02F_script03_1_M029,neu,the worst one was in cannes when your curling iron burnt a hole in my new dressing gown.,Ses02M
Ses02F_script03_1_M031,neu,i didn't hit you very hard.,Ses02M
Ses02F_script03_1_M032,hap,"oh, i'll never forget his face.",Ses02M
Ses02F_script03_1_M033,neu,we were very much younger then.,Ses02M
Ses02F_script03_1_M034,neu,"as a matter of fact, the real cause of that row was peter burden.",Ses02M
Ses02F_script03_2_F007,neu,"well, if you hadn't been so suspicious and nosey, you never would have known a thing about it.",Ses02F
Ses02F_script03_2_F011,neu,just seems so silly to go on and on and on with such a thing.,Ses02F
Ses02F_script03_2_F012,neu,"well, it's become a habit with you.",Ses02F
Ses02F_script03_2_F013,ang,don't be so stupid.,Ses02F
Ses02F_script03_2_F014,ang,what?,Ses02F
Ses02F_script03_2_F016,hap,"a woman's job is to allure the man. watch me a minute, will you?",Ses02F
Ses02F_script03_2_F018,ang,"oh, be quiet.",Ses02F
Ses02F_script03_2_F020,ang,"adders don't snap, they sting.",Ses02F
Ses02F_script03_2_F025,ang,you're quite insufferable,Ses02F
Ses02F_script03_2_F029,ang,shut up.,Ses02F
Ses02F_script03_2_F031,ang,why?,Ses02F
Ses02F_script03_2_F034,ang,"turn it on again, please.",Ses02F
Ses02F_script03_2_F035,ang,"very well, if you insist on being boorish and idiotic.",Ses02F
Ses02F_script03_2_F036,ang,you are far too temperamental. try to control yourself.,Ses02F
Ses02F_script03_2_F037,ang,stop it. go away. i hate you.,Ses02F
Ses02F_script03_2_F038,ang,"listen? listen, indeed. i am sick and tired of listening to you, damn sadistic bully.",Ses02F
Ses02F_script03_2_F039,ang,"i hate you. stop it. stop it. i hate you, do you hear? you're conceited and overbearing and utterly impossible.",Ses02F
Ses02F_script03_2_F040,ang,this is the end. finally and forever. do you hear me? the end.,Ses02F
Ses02F_script03_2_F041,ang,"oh yes, i am.",Ses02F
Ses02F_script03_2_F042,ang,i am. let go of me. you're a cruel fiend and i hate and loathe you.,Ses02F
Ses02F_script03_2_F043,ang,thank god i realized what you are-- i'd never marry you again ever in my life. you're a cruel fiend and i hate you. you're a beast. you're a beast--i hate you. stop it. stop it.,Ses02F
Ses02F_script03_2_M000,neu,"as a matter of fact, the real cause of that row was peter burden.",Ses02M
Ses02F_script03_2_M001,neu,i knew nothing of the sort. you took presents from him.,Ses02M
Ses02F_script03_2_M006,ang,what of it?,Ses02M
Ses02F_script03_2_M007,ang,"well, what about me?",Ses02M
Ses02F_script03_2_M009,neu,"me, too. bored stiff. you want some brandy?",Ses02M
Ses02F_script03_2_M011,neu,no particular reason. anyhow they were very small ones.,Ses02M
Ses02F_script03_2_M013,ang,"you needn't be so grand, just because you don't happen to want any yourself at the moment.",Ses02M
Ses02F_script03_2_M027,ang,i'm not in the least drunk.,Ses02M
Ses02F_script03_2_M030,ang,"we could get a good debate going about this, don't you think? intemperate tots.",Ses02M
Ses02F_script03_2_M036,ang,i'll do no such thing.,Ses02M
Ses02F_script03_2_M037,ang,turn it off. it's driving me mad.,Ses02M
Ses02F_script03_2_M038,ang,turn it off.,Ses02M
Ses02F_script03_2_M039,ang,"amanda, listen. listen",Ses02M
Ses02F_script03_2_M041,ang,"you're a vile, tempered, loose living, wicked little beast and i hope to never see you again as long as i live.",Ses02M
Ses02F_script03_2_M042,ang,you're not going like this.,Ses02M
Ses02F_script03_2_M043,ang,you're not.,Ses02M
Ses02F_script03_2_M044,ang,shut up. shut up.,Ses02M
Ses02F_script03_2_M045,ang,i wouldn't-- i wouldn't marry--,Ses02M
Ses02F_script03_2_M046,ang,i wouldn't marry you if you came in crawling on your knees,Ses02M
Ses02F_script03_2_M047,ang,you're a evil vampire and i hope to god i never see you again as long as i live.,Ses02M
Ses02M_impro01_F000,neu,"hi, how can i help you?",Ses02F
Ses02M_impro01_F001,neu,"sure, um",Ses02F
Ses02M_impro01_F002,neu,do you have two forms of id with you?,Ses02F
Ses02M_impro01_F003,neu,"i actually need two forms of id. i need either a passport or a birth certificate, or social security card. i'm sorry.",Ses02F
Ses02M_impro01_F004,neu,well,Ses02F
Ses02M_impro01_F005,neu,i- i can take your driver's license but i need another form of id in order to process this paper work.,Ses02F
Ses02M_impro01_F006,neu,"um, that you would need to go home and get another form of id and come back.",Ses02F
Ses02M_impro01_F015,neu,"i'm sorry, sir.",Ses02F
Ses02M_impro01_F016,neu,there is nothing i can do.,Ses02F
Ses02M_impro01_M001,neu,"yea. i just want to get this done,",Ses02M
Ses02M_impro01_M002,neu,get my new license.,Ses02M
Ses02M_impro01_M003,neu,"um, no, i got my driver's license though.",Ses02M
Ses02M_impro01_M004,neu,"uh, sorry, i forgot them. i mean i've got to -",Ses02M
Ses02M_impro01_M005,neu,well is the dri-driver's license going to work?,Ses02M
Ses02M_impro01_M007,ang,"what? i- you telling me i waited in that huge line to go and sit down and get my number called, like after",Ses02M
Ses02M_impro01_M008,ang,three hours and,Ses02M
Ses02M_impro01_M009,ang,shouldn't they have like told us about that? i mean why - why would they make me go and wait three hours if i have got to go and do it again?,Ses02M
Ses02M_impro01_M010,ang,"it's standard? i mean i don't work at the d.m.v. how am i supposed to know that, like, i stand in line, i get my",Ses02M
Ses02M_impro01_M011,ang,"i filled out the application right, didn't i?",Ses02M
Ses02M_impro01_M018,ang,you- shouldn't you have like a sign or something maybe like up on the counter when you get the applica- maybe on the application,Ses02M
Ses02M_impro01_M019,ang,"what web- i didn't go to a website - why would i need to - it's the d.m.v.. you come to the d.m.v., you wait in line for three hours, and then you go home.",Ses02M
Ses02M_impro02_F000,sad,i don't want you to go.,Ses02F
Ses02M_impro02_F001,sad,"i'm going to miss you too; i don't know what i'm going to do here without you. it's going to be so lonely, and so hard.",Ses02F
Ses02M_impro02_F002,sad,i don't want to be a single mom.,Ses02F
Ses02M_impro02_F003,sad,but,Ses02F
Ses02M_impro02_F004,sad,it's dangerous; i mean how can you make sure that you'll,Ses02F
Ses02M_impro02_F005,sad,i hope so.,Ses02F
Ses02M_impro02_F006,sad,i hope so.,Ses02F
Ses02M_impro02_F007,sad,it's going to be really rough.,Ses02F
Ses02M_impro02_F008,sad,i'll send you lots of pictures.,Ses02F
Ses02M_impro02_F009,sad,"well, just promise me that you going to be safe.",Ses02F
Ses02M_impro02_F010,sad,"i mean can't they put you in like, you know kitchen work or something where you won't get",Ses02F
Ses02M_impro02_F012,sad,"will you write me letters, paper ones?",Ses02F
Ses02M_impro02_F013,sad,"our baby needs a dad; you can't leave. okay, you can't disappear.",Ses02F
Ses02M_impro02_F014,sad,i'll miss you too.,Ses02F
Ses02M_impro02_M000,sad,"i know, i know. i don't want to go either baby. i love you know. and i'm going to miss you a lot.",Ses02M
Ses02M_impro02_M001,sad,"you won't be. i'll be back; i'll be back before you know it. all right, and",Ses02M
Ses02M_impro02_M002,sad,and,Ses02M
Ses02M_impro02_M007,sad,"you gotta take care of our baby for me, alright?",Ses02M
Ses02M_impro02_M008,sad,"i hope so, because i'm not going to be able to survive without all that. i don't know what i'm going to do.",Ses02M
Ses02M_impro02_M009,sad,i've never been - i've never been away from you for two weeks let alone a year.,Ses02M
Ses02M_impro02_M013,sad,there's people that thought it was the right thing to do so now we have to- we have to do what we have to do for our country,Ses02M
Ses02M_impro02_M014,neu,"and it'll work out you know, go there and do that. yeah, i'll be back",Ses02M
Ses02M_impro02_M017,sad,"our baby has a dad, alright. daddy is going to be back soon.",Ses02M
Ses02M_impro02_M018,sad,"i want you to, you know, take lots of video; pictures and i can see you when i get back or while i'm there. i'm going to miss you.",Ses02M
Ses02M_impro03_F000,hap,what? what? you look really happy what's going on?,Ses02F
Ses02M_impro03_F001,hap,finally did what?,Ses02F
Ses02M_impro03_F003,hap,"oh, my gosh. well, and did",Ses02F
Ses02M_impro03_F004,hap,did she say yes?,Ses02F
Ses02M_impro03_F005,hap,that's like the most definitive.,Ses02F
Ses02M_impro03_F007,hap,i would have thought you would have told me that you were planning on doing this.,Ses02F
Ses02M_impro03_F008,hap,"yea, i guess so. oh, my gosh. was she surprised?",Ses02F
Ses02M_impro03_F011,hap,"oh, you did not.",Ses02F
Ses02M_impro03_F012,hap,"oh, my gosh. that's so cute",Ses02F
Ses02M_impro03_F013,hap,"that's so romantic. oh, my gosh. she must have died. that's like one of those things you write into a magazine about like my boyfriend did this. oh my god.",Ses02F
Ses02M_impro03_F014,hap,she must have flipped out.,Ses02F
Ses02M_impro03_F015,hap,right exactly because you can't say no in front of thousands of people. [laughter],Ses02F
Ses02M_impro03_F016,hap,did you bring her up on stage too?,Ses02F
Ses02M_impro03_F017,hap,"oh, my gosh, that's so cute.",Ses02F
Ses02M_impro03_F018,hap,are your parents excited or...?,Ses02F
Ses02M_impro03_F020,hap,"ooh, that would be fun.",Ses02F
Ses02M_impro03_F023,hap,"oh my gosh. i cannot believe you're getting married, that is so cool.",Ses02F
Ses02M_impro03_F024,hap,"golly, it just makes me all like romantic inside, like i really want that to happen to me. [laughter]",Ses02F
Ses02M_impro03_F028,hap,"yay, well congratulations, that's so cool. [breathing] i can't wait.",Ses02F
Ses02M_impro03_M000,hap,"oh, you're never going to believe it.",Ses02M
Ses02M_impro03_M001,hap,"well, i finally did it",Ses02M
Ses02M_impro03_M005,hap,"yes, she said yes. [laughter] i know",Ses02M
Ses02M_impro03_M008,hap,"yes, yes. you know, she - she was like - i mean, she was happy, you know",Ses02M
Ses02M_impro03_M009,hap,"i - i think it was about time, i don't know, maybe. you know what, it's been it's been long enough now.",Ses02M
Ses02M_impro03_M010,hap,"oh, well, it was -- you know, we were at this- at this concert and yeah",Ses02M
Ses02M_impro03_M011,hap,so i-i talked to some of the crew before hand and-,Ses02M
Ses02M_impro03_M012,hap,i-i did.,Ses02M
Ses02M_impro03_M014,hap,"i know, so",Ses02M
Ses02M_impro03_M015,hap,i got to freak her out.,Ses02M
Ses02M_impro03_M016,hap,"no, yes -- so",Ses02M
Ses02M_impro03_M017,hap,"yea, that way she was guaranteed that she could not say no.",Ses02M
Ses02M_impro03_M018,hap,"no, but it was good.",Ses02M
Ses02M_impro03_M019,hap,"yes, yes. [laughter]",Ses02M
Ses02M_impro03_M020,hap,"i know it was, i don't know i was really nervous but i'm really - i'm really glad.",Ses02M
Ses02M_impro03_M021,hap,"oh yes, they - they you know they love her and so i mean...",Ses02M
Ses02M_impro03_M024,hap,"yea, yea, i'm not too sure where yet i guess you know, i kind of got to figure some stuff out here first",Ses02M
Ses02M_impro03_M026,hap,i know.,Ses02M
