file,emotion,text,speaker
Ses03M_impro05b_F020,neu,"i mean, our airline's fault. i don't know what happened, misplaced, something happened but we will get you--",Ses03F
Ses03M_impro05b_F021,neu,"well, the entire flight, sir, the luggage was placed on another plane that never actually left baltimore.",Ses03F
Ses03M_impro05b_F022,neu,uh no i'm not.,Ses03F
Ses03M_impro05b_F023,neu,"well we have some people back there that need some firing so, but i would just really appreciate--",Ses03F
Ses03M_impro05b_F027,neu,"yes sir, yes.",Ses03F
Ses03M_impro05b_F028,neu,we can have them direct your luggage to san diego.,Ses03F
Ses03M_impro05b_F029,neu,uh--,Ses03F
Ses03M_impro05b_F030,neu,some refreshments in the lobby?,Ses03F
Ses03M_impro05b_M008,ang,most of the...,Ses03M
Ses03M_impro05b_M011,ang,i'm going to san diego tomorrow to stay with my family. what do i need hotel lodging for hmmm? can you tell me that?,Ses03M
Ses03M_impro05b_M013,ang,wow. thank you. holiday inn. wow. thank...the flight cost five hundred dollars.,Ses03M
Ses03M_impro05b_M014,ang,"okay, so you can put me in holiday inn for twenty dollar a night?",Ses03M
Ses03M_impro05b_M015,ang,of course i had my name tags on the luggage.,Ses03M
Ses03M_impro05b_M016,ang,soon as you...that's not good enough okay?,Ses03M
Ses03M_impro05b_M019,neu,i work for ibm.,Ses03M
Ses03M_impro05b_M020,ang,"you misplace a lot of, eight pieces of luggage.",Ses03M
Ses03M_impro05b_M021,ang,are you kidding me?,Ses03M
Ses03M_impro05b_M022,ang,who are you going to fire because of that?,Ses03M
Ses03M_impro05b_M023,ang,"wow. this has never happened before. i've not lost,",Ses03M
Ses03M_impro05b_M024,ang,in all thousand flights i've been on probably i can't even count how many flights i've been on. this has never happened before.,Ses03M
Ses03M_impro05b_M025,ang,this is the worst customer service i've ever gotten before.,Ses03M
Ses03M_impro05b_M026,ang,okay. get on the phone and figure out where my luggage is and tell me when it's going to get there alright?,Ses03M
Ses03M_impro05b_M027,ang,"and and, in about...",Ses03M
Ses03M_impro05b_M029,ang,can you get it to the san diego airport? you get someone to drive it to my place alright? then i get a refund for some...i get a free flight alright? i get free whatever.,Ses03M
Ses03M_impro05b_M031,ang,some peanuts? wow. that helps a lot.,Ses03M
Ses03M_impro05b_M032,ang,"thanks you, thank you i don't have my luggage so you gave me a holiday inn stay and peanuts. wow. you know what?",Ses03M
Ses03M_impro05b_M033,ang,i will never do business with delta again.,Ses03M
Ses03M_impro06_F000,sad,how's it going? how are you feeling?,Ses03F
Ses03M_impro06_F001,sad,hanging in there?,Ses03F
Ses03M_impro06_F002,sad,so sad.,Ses03F
Ses03M_impro06_F003,sad,yeah.,Ses03F
Ses03M_impro06_F004,sad,you guys were real close huh?,Ses03F
Ses03M_impro06_F005,sad,i'm so sorry.,Ses03F
Ses03M_impro06_F007,sad,what happened? what went wrong?,Ses03F
Ses03M_impro06_F008,sad,oh man.,Ses03F
Ses03M_impro06_F009,sad,how are they?,Ses03F
Ses03M_impro06_F010,sad,yeah. like i mean if you need anyone to talk to or anything i'm here for you okay?,Ses03F
Ses03M_impro06_F011,sad,we're all here for you.,Ses03F
Ses03M_impro06_F012,sad,i know.,Ses03F
Ses03M_impro06_F013,sad,just things happen in life and you just...there's just no explanation you know? we just don't...,Ses03F
Ses03M_impro06_F014,sad,yeah.,Ses03F
Ses03M_impro06_F015,sad,i'm so sorry.,Ses03F
Ses03M_impro06_F016,sad,"well now you can follow his footsteps, you know? carry out what he wanted to do.",Ses03F
Ses03M_impro06_F017,sad,well sure you could.,Ses03F
Ses03M_impro06_F018,sad,yeah.,Ses03F
Ses03M_impro06_F019,sad,i would've loved to.,Ses03F
Ses03M_impro06_F020,sad,now i can't.,Ses03F
Ses03M_impro06_M000,sad,i ah--,Ses03M
Ses03M_impro06_M001,sad,alright.,Ses03M
Ses03M_impro06_M002,sad,yeah.,Ses03M
Ses03M_impro06_M003,sad,it just feels like i was talking to him yesterday.,Ses03M
Ses03M_impro06_M004,sad,he was my only friend growing up.,Ses03M
Ses03M_impro06_M005,sad,no one else would talk to me but he would.,Ses03M
Ses03M_impro06_M006,sad,he was supposed to be the best man at my wedding.,Ses03M
Ses03M_impro06_M007,sad,yeah.,Ses03M
Ses03M_impro06_M008,sad,you know i was always the one to tell him to be more wild you know?,Ses03M
Ses03M_impro06_M009,sad,and he just took it overboard.,Ses03M
Ses03M_impro06_M010,sad,you know a stupid case of drunk driving it's just...,Ses03M
Ses03M_impro06_M011,sad,"and the worst part of it is that he was in the car with his girlfriend,",Ses03M
Ses03M_impro06_M012,sad,his girlfriend got killed too.,Ses03M
Ses03M_impro06_M013,sad,and the car that he hit was his family.,Ses03M
Ses03M_impro06_M014,sad,the mother and father died--,Ses03M
Ses03M_impro06_M015,sad,and the kids are paralyzed in a coma right now.,Ses03M
Ses03M_impro06_M016,sad,and just going to the funeral it's-,Ses03M
Ses03M_impro06_M017,sad,"-do i miss him or do i hate him, you know?",Ses03M
Ses03M_impro06_M018,sad,i was supposed to see him last summer,Ses03M
Ses03M_impro06_M019,sad,then i got busy with work and stuff and three years go by,Ses03M
Ses03M_impro06_M020,sad,and then something like this happens you know?,Ses03M
Ses03M_impro06_M021,sad,i mean i haven't even talked to him on the phone for the past three months.,Ses03M
Ses03M_impro06_M022,sad,he's supposed to be my best friend.,Ses03M
Ses03M_impro06_M023,sad,it's so fucked up.,Ses03M
Ses03M_impro06_M024,sad,why is that?,Ses03M
Ses03M_impro06_M025,sad,he was studying to be a doctor.,Ses03M
Ses03M_impro06_M026,sad,"i mean he was...he wanted to help people in poor countries, that is his goal. he didn't care about the money. he just wanted to go and help people.",Ses03M
Ses03M_impro06_M027,sad,what the...what am i doing?,Ses03M
Ses03M_impro06_M028,sad,working for corporate america? wow.,Ses03M
Ses03M_impro06_M029,sad,he actually wanted to do something.,Ses03M
Ses03M_impro06_M030,sad,i can't do that.,Ses03M
Ses03M_impro06_M031,sad,you should've met him.,Ses03M
Ses03M_impro06_M032,sad,he is the greatest...everyone liked him.,Ses03M
Ses03M_impro07_F000,hap,hey. how's it going? i haven't seen you in awhile.,Ses03F
Ses03M_impro07_F001,hap,what's going on joe?,Ses03F
Ses03M_impro07_F006,hap,you're going to be here and i'm going to be in la so we can be together now. i mean we can be in the same city.,Ses03F
Ses03M_impro07_F007,hap,we can party. we can have fun.,Ses03F
Ses03M_impro07_F008,hap,yeah. hopefully it won't be like high school.,Ses03F
Ses03M_impro07_F009,hap,"oh man i am so proud of you, that is...how did you get...i mean what did you do? how did you find out or what...?",Ses03F
Ses03M_impro07_F010,hap,oh man.,Ses03F
Ses03M_impro07_F011,hap,did you say yes yet? i mean have you sent in your answer?,Ses03F
Ses03M_impro07_F012,hap,all right.,Ses03F
Ses03M_impro07_F013,hap,"this is so great, you know, because i gone fit on downtown so i'm going to be like right here. i think i'm going to be living at city lights downtown.",Ses03F
Ses03M_impro07_F014,hap,"yeah, it really is.",Ses03F
Ses03M_impro07_F016,hap,man i'm just so happy for you. i just--,Ses03F
Ses03M_impro07_F017,hap,"well, i'm happy for you but i'm happy for me cause that means you're going to stay.",Ses03F
Ses03M_impro07_F018,hap,oh great. i would love to go.,Ses03F
Ses03M_impro07_F019,hap,mmmm some miso soup.,Ses03F
Ses03M_impro07_F023,neu,oh my god. i am so proud of you.,Ses03F
Ses03M_impro07_M002,hap,guess who got into u.s.c.?,Ses03M
Ses03M_impro07_M003,hap,"me. yeah, i did.",Ses03M
Ses03M_impro07_M004,hap,yeah.,Ses03M
Ses03M_impro07_M005,hap,i got into the...,Ses03M
Ses03M_impro07_M006,hap,i got into cinema production.,Ses03M
Ses03M_impro07_M007,hap,yeah.,Ses03M
Ses03M_impro07_M008,hap,no. it's like it's harder than getting into harvard.,Ses03M
Ses03M_impro07_M009,neu,what does that mean?,Ses03M
Ses03M_impro07_M010,hap,holy shit...,Ses03M
Ses03M_impro07_M011,hap,this will be like high school but even better.,Ses03M
Ses03M_impro07_M013,hap,"i have some bad news. i was like what? she's like not really you got into u.s.c. and i was like, i was like oh my god. i was about to tear my own hair out.",Ses03M
Ses03M_impro07_M014,hap,yeah. this is so crazy. i mean i didn't get into any other school but i got into the school i wanted.,Ses03M
Ses03M_impro07_M015,hap,oh my god the first minute i got it i sent it back in.,Ses03M
Ses03M_impro07_M016,hap,so...,Ses03M
Ses03M_impro07_M017,hap,this is so exciting. this is like a new chapter in our lives.,Ses03M
Ses03M_impro07_M018,hap,"we're doing what we want to do, then four years later we're going to be working professionals, making money, sipping martinis every day.",Ses03M
Ses03M_impro07_M019,hap,thank you,Ses03M
Ses03M_impro07_M020,hap,and tonight my parents want to take me out to sushi and they said i could bring you.,Ses03M
Ses03M_impro07_M022,hap,yeah and they said get whatever you want and...,Ses03M
Ses03M_impro07_M023,hap,some miso soup. you can get whatever. you can get a vat full of miso soup. god.,Ses03M
Ses03M_impro07_M024,hap,this is going to be so great. i have so many great ideas.,Ses03M
Ses03M_impro07_M025,hap,"it took them, oh man, it took them like, i mean what it's like april now and any letters that come in april are usually the rejection letters so i was just like...",Ses03M
Ses03M_impro08a_F004,neu,two two six six.,Ses03F
Ses03M_impro08a_F013,ang,"you sign the contract and then down the line the phone doesn't work and you're stuck, you can't go to a new...no. no contracts for me. you give me a new phone.",Ses03F
Ses03M_impro08a_F014,ang,i want to talk to a supervisor,Ses03F
Ses03M_impro08a_F015,ang,i would like to talk to your supervisor. obviously you're incompetent and don't understand what i'm asking.,Ses03F
Ses03M_impro08a_F020,ang,this is ridiculous.well what are we supposed to do? we starve then because i can't use my phone cause,Ses03F
Ses03M_impro08a_F021,ang,"i am a realtor and this is my business. people are calling me all the time but you know, and i don't have a land line. i can't afford to have a land line",Ses03F
Ses03M_impro08a_F022,ang,that you better be sorry.,Ses03F
Ses03M_impro08a_M000,neu,hello. this is viacom services. how can i help you?,Ses03M
Ses03M_impro08a_M001,neu,"i'm sorry ma'am, what can i help you with?",Ses03M
Ses03M_impro08a_M002,neu,okay. can you give me the last four digits of your social security number so i can verify who i'm speaking with?,Ses03M
Ses03M_impro08a_M003,neu,okay. and your name is?,Ses03M
Ses03M_impro08a_M004,neu,olivia. um. okay. so how long has this problem been?,Ses03M
Ses03M_impro08a_M005,neu,so what exactly is the problem?,Ses03M
Ses03M_impro08a_M006,neu,um- i think part of it has to do with the network being down. it's been having some trouble the last few weeks--,Ses03M
Ses03M_impro08a_M007,neu,i understand--we're not-,Ses03M
Ses03M_impro08a_M008,neu,no. okay. we're not charging you for any of these months. we're going to give you three months free.,Ses03M
Ses03M_impro08a_M009,neu,we can give you a new phone--,Ses03M
Ses03M_impro08a_M010,neu,we can do that. we can do that. you just have to sign a one-year contract though with the--,Ses03M
Ses03M_impro08a_M012,neu,"um- let me connect you to my supervisor. actually, he's out right now so i'm supervisor until he comes back. um-",Ses03M
Ses03M_impro08a_M013,neu,"so you could----speak with me some more, you could call back later on maybe.",Ses03M
Ses03M_impro08a_M016,neu,"mmm hmmm. mmm hmmm. the power outages, everything, hurricane katrina. everything's really messed up.",Ses03M
Ses03M_impro08a_M017,neu,don't you-,Ses03M
Ses03M_impro08a_M018,neu,i'm really sorry ma'am. there's not----a lot we can do for it.,Ses03M
Ses03M_impro08a_M019,neu,"what i can do for you, if you want to make a call right now i could contact you through our computer. i can call through my phone and you can speak through me.",Ses03M
Ses03M_impro08a_M020,neu,i'm sorry it has to do with an electrical power outage and stuff--,Ses03M
Ses03M_impro08a_M021,neu,"well, okay i'm going to give you a free phone card that you can use at any payphone and that's on us. okay?",Ses03M
Ses03M_impro08a_M022,neu,"i'm, i'm sorry you chose to live there um--",Ses03M
Ses03M_impro08a_M023,neu,well i'm sure maybe there's a phone at work you could use.,Ses03M
Ses03M_impro08a_M024,neu,all right um--,Ses03M
Ses03M_impro08a_M025,neu,my name is sara.,Ses03M
Ses03M_impro08a_M026,neu,sara brown.,Ses03M
Ses03M_impro08a_M027,neu,"you know maam, we record this conversation so anything you say can be proven in a law of court so keep that in mind.",Ses03M
Ses03M_impro08b_F005,ang,"yeah, yeah, yeah you better be sorry.",Ses03F
Ses03M_impro08b_F006,ang,no i did not drop my phone in water. i'm not five years old and just dropped my phone anywhere i see it. okay this is my business.,Ses03F
Ses03M_impro08b_F021,neu,"alright. well- i guess - i guess that's okay but,",Ses03F
Ses03M_impro08b_F023,neu,okay.,Ses03F
Ses03M_impro08b_F024,neu,alright thanks.,Ses03F
Ses03M_impro08b_M000,neu,hello?,Ses03M
Ses03M_impro08b_M001,neu,i'm sorry ma'am. what's the nature of your problem? but first can i get you to tell me your first and last name?,Ses03M
Ses03M_impro08b_M002,neu,i know i just need to verify every time. i'm sorry.,Ses03M
Ses03M_impro08b_M003,neu,alright ms. brown what's the nature of your problem?,Ses03M
Ses03M_impro08b_M004,neu,oh. i'm sorry. um- did you drop it in water?,Ses03M
Ses03M_impro08b_M005,neu,"um- well it's probably easy. can you any more symptoms either you're not receiving calls----ok, you're not receiving calls, not getting calls.",Ses03M
Ses03M_impro08b_M006,neu,is the phone turned on?,Ses03M
Ses03M_impro08b_M007,neu,"well, um- okay. your sim card is in- didn't fall out-",Ses03M
Ses03M_impro08b_M008,neu,alright. um- well that could be the problem. cause--,Ses03M
Ses03M_impro08b_M009,neu,you might have an older phone where we would use sim cards but probably not.,Ses03M
Ses03M_impro08b_M010,neu,okay. how about this we'll send you a brand new camera phone with palm pilot-- and-,Ses03M
Ses03M_impro08b_M011,neu,"so we'll send it- and we'll give you, how about a free year's service?",Ses03M
Ses03M_impro08b_M012,neu,tell them my name. my name is brent backersen.,Ses03M
Ses03M_impro08b_M013,neu,okay. tell them my - my id number is two one three five.,Ses03M
Ses03M_impro08b_M014,neu,"tell them that. you can go in, get a brand new phone, they'll hook you up with service even give you a free three months--",Ses03M
Ses03M_impro08b_M015,neu,it will be free. no contract okay?,Ses03M
Ses03M_impro08b_M016,neu,"go in there, yeah, go in there. tell them brent backersen sent you.",Ses03M
Ses03M_impro08b_M017,neu,"the top of the line camera phone, game boy, anything you want. for free. and palm pilot.",Ses03M
Ses03M_impro08b_M018,neu,they might only have orange.,Ses03M
Ses03M_impro08b_M019,neu,"okay. they can figure out pink for you. so go in there and just tell them that and they'll hook you up with other goodies, stuff like that free service, no contract, no nothing. just for being a good customer",Ses03M
Ses03M_impro08b_M020,neu,and battling through with us.,Ses03M
Ses03M_impro08b_M021,neu,yes. you just tell them brent backersen sent you.,Ses03M
Ses03M_impro08b_M022,neu,alright? great. have a nice evening.,Ses03M
Ses03M_script01_1_F000,neu,what's he going to say? maybe we ought to talk to him before he sees it.,Ses03F
Ses03M_script01_1_F004,sad,did you talk to him?,Ses03F
Ses03M_script01_1_F005,sad,he cried hard?,Ses03F
Ses03M_script01_1_F008,sad,"he's getting just like he did after he died, you know? what, what, what's the meaning of this?",Ses03F
Ses03M_script01_1_F016,ang,no. it's his god damned newspapers is what it is. now every month there's a new boy comes home and larry's going to be the next one.,Ses03F
Ses03M_script01_1_F017,ang,why?,Ses03F
Ses03M_script01_1_F020,ang,"well what do you want me to do? i mean, you're old enough to know your own mind.",Ses03F
Ses03M_script01_1_F021,neu,"well, i mean, you got to make sure your dad's not going--",Ses03F
Ses03M_script01_1_F028,neu,did you ask annie yet?,Ses03F
Ses03M_script01_1_F030,neu,"look, you never had seen many, many women. you know? i mean...",Ses03F
Ses03M_script01_1_F038,ang,you're just going to leave the business? you have a business here. you can't do that.,Ses03F
Ses03M_script01_1_F040,sad,tell me something. you can leave this business?,Ses03F
Ses03M_script01_1_F043,ang,"i mean what the hell have we worked for then? i mean, it's all for you chris. the whole shooting match is for you.",Ses03F
Ses03M_script01_1_F045,sad,i don't understand you do i?,Ses03F
Ses03M_script01_1_F046,sad,yeah. i can see that.,Ses03F
Ses03M_script01_1_M000,sad,he saw it.,Ses03M
Ses03M_script01_1_M001,sad,he was out there when it happened.,Ses03M
Ses03M_script01_1_M002,sad,about four in the morning. i heard a crack and i looked out and he was standing right there when it happened.,Ses03M
Ses03M_script01_1_M003,sad,i don't know. but after it cracked he ran back into the house and he cried in the kitchen.,Ses03M
Ses03M_script01_1_M004,sad,no. i figured the best thing to do was leave him alone.,Ses03M
Ses03M_script01_1_M005,sad,i could hear it right through the floor.,Ses03M
Ses03M_script01_1_M006,sad,i guess he is.,Ses03M
Ses03M_script01_1_M007,sad,"i don't know. but i know one thing mom, we made a terrible mistake with dad.",Ses03M
Ses03M_script01_1_M009,ang,you know that larry's not coming back and i know that too. why we both go on letting him think that we both believe with him.,Ses03M
Ses03M_script01_1_M011,ang,"why shouldn't he walk around and dream at him at night. walk around. why shouldn't he walk around? why shouldn't he dream of him, walk around at night waiting for him? do we contradict him? do we say flat out that we don't have anymore hope?",Ses03M
Ses03M_script01_1_M012,ang,that we haven't had any hope for years now?,Ses03M
Ses03M_script01_1_M017,neu,"you know why i asked annie here, right?",Ses03M
Ses03M_script01_1_M019,neu,i want to ask her to marry me.,Ses03M
Ses03M_script01_1_M021,neu,okay. so then it's alright. i'll go ahead with it.,Ses03M
Ses03M_script01_1_M022,ang,oh see then it's just not my business. god you infuriate me sometimes. isn't my business too if dad throws a fit? huh? god you have such a talent for ignoring things.,Ses03M
Ses03M_script01_1_M027,ang,well to hell with that.,Ses03M
Ses03M_script01_1_M028,neu,i wanted to get this settled first.,Ses03M
Ses03M_script01_1_M029,neu,then i guess that's the end of it.,Ses03M
Ses03M_script01_1_M030,sad,but from her letters i think she's forgotten him. i'll find out.,Ses03M
Ses03M_script01_1_M031,neu,"and then we'll thrash it out with dad right? mom, don't avoid me.",Ses03M
Ses03M_script01_1_M036,sad,i've given it three years of thought and i thought that if i waited then dad would forget about larry and then we could have a regular wedding and everything happy.,Ses03M
Ses03M_script01_1_M037,neu,but if i can't have that here i'll get out.,Ses03M
Ses03M_script01_1_M038,neu,i'll get out. i'll marry her somewhere else. maybe new york.,Ses03M
Ses03M_script01_1_M039,ang,i've been a good son too long. a good sucker and i'm through with it.,Ses03M
Ses03M_script01_1_M040,ang,the business doesn't inspire me.,Ses03M
Ses03M_script01_1_M041,ang,yes. i like it an hour out of the day. if i have to grub for money all day long at least at evening i want it beautiful. i want a family. i want a wife. i want some kids. i want to build something i can give myself to.,Ses03M
Ses03M_script01_1_M043,neu,yes. on this i would.,Ses03M
Ses03M_script01_1_M045,sad,i know. just you help me stay here.,Ses03M
Ses03M_script01_1_M046,sad,i am thinking like that.,Ses03M
Ses03M_script01_1_M047,sad,no you don't. i'm a pretty tough guy.,Ses03M
Ses03M_script01_2_F000,ang,why did he invite her here?,Ses03F
Ses03M_script01_2_F001,ang,well she's been away for three and a half years in new york and suddenly she just shows up.,Ses03F
Ses03M_script01_2_F006,ang,no. she's not his girl joe and she knows that.,Ses03F
Ses03M_script01_2_F009,ang,"i mean, her faith is stronger than a rock.",Ses03F
Ses03M_script01_2_F010,sad,"my worst times i think about her, you know, and i",Ses03F
Ses03M_script01_2_F011,sad,it's like i know as long as she's waiting i'm right again.,Ses03F
Ses03M_script01_2_F012,ang,"no. nobody in my house better dare and challenge her faith. you know and maybe strangers but not his father, not his brother.",Ses03F
Ses03M_script01_2_F015,ang,"laugh, laugh at me but i will. because you know what happened when she came here? when she came back she slept in his room, the memorial broke into pieces. joe, look. look at it. you got to believe with me.",Ses03F
Ses03M_script01_2_F017,sad,"look, it was just last week that detroit, some boy came back he had been away longer than larry, you can read it for yourself. you above all people have got to believe.",Ses03F
Ses03M_script01_2_F019,sad,i can't help it.,Ses03F
Ses03M_script01_2_M001,neu,"well maybe, maybe he just wanted to see her.",Ses03M
Ses03M_script01_2_M004,neu,who said he even thought about that?,Ses03M
Ses03M_script01_2_M005,neu,"well, so what?",Ses03M
Ses03M_script01_2_M008,neu,how do you know why she's waited? hmmm?,Ses03M
Ses03M_script01_2_M014,ang,"alright, alright, calm yourself okay? calm yourself. wait, wait. what do you mean, me above all?",Ses03M
Ses03M_script01_2_M015,ang,"wait, what does that mean? me above all?",Ses03M
Ses03M_script01_2_M016,ang,"look at you, you're shaking.",Ses03M
Ses03M_script01_2_M017,ang,what do i got to hide? huh? what the hell's the matter with you kate?,Ses03M
Ses03M_script01_3_F004,sad,no. i'm not sorry. but i'm not going to stay.,Ses03F
Ses03M_script01_3_F006,sad,"look,",Ses03F
Ses03M_script01_3_F007,sad,"you saw the way that she acted and then well, i mean, you, you were acting kind of...",Ses03F
Ses03M_script01_3_F008,sad,"well, i don't know, embarrassed of her since i came.",Ses03F
Ses03M_script01_3_F011,hap,"well,",Ses03F
Ses03M_script01_3_F012,hap,i guess that's why i came.,Ses03F
Ses03M_script01_3_F013,hap,"look, i've been ready for a long, long time now.",Ses03F
Ses03M_script01_3_F014,hap,"look, i almost got married two years ago.",Ses03F
Ses03M_script01_3_F015,hap,you started to write me.,Ses03F
Ses03M_script01_3_F016,hap,every day since.,Ses03F
Ses03M_script01_3_F017,hap,"i was waiting for you chris, i mean, till then you never wrote and then when you did what did you say?",Ses03F
Ses03M_script01_3_F018,hap,you'd always be so ambiguous.,Ses03F
Ses03M_script01_3_F019,hap,i'll never forgive you for that.,Ses03F
Ses03M_script01_3_F020,hap,"i mean, why did you wait all these years? there i was sitting around and wondering if i was crazy for thinking about you.",Ses03F
Ses03M_script01_3_F021,hap,not like that you're not.,Ses03F
Ses03M_script01_3_F029,sad,how many?,Ses03F
Ses03M_script01_3_F030,sad,geez.,Ses03F
Ses03M_script01_3_F031,sad,and you still feel that way?,Ses03F
Ses03M_script01_3_F033,sad,"that includes me too, i mean and the money, you have right to that money. your father put planes up in the air, good planes and he deserves it, you should be proud of that. a man should be paid for that.",Ses03F
Ses03M_script01_3_F034,hap,what am i going to do with a fortune?,Ses03F
Ses03M_script01_3_M001,neu,you're not sorry you came?,Ses03M
Ses03M_script01_3_M004,neu,what?,Ses03M
Ses03M_script01_3_M008,hap,"i mean, that's the reason why i asked you here.",Ses03M
Ses03M_script01_3_M010,hap,i love you.,Ses03M
Ses03M_script01_3_M016,hap,you felt something that far back.,Ses03M
Ses03M_script01_3_M018,hap,"give me a kiss ann, just give me...",Ses03M
Ses03M_script01_3_M019,hap,"oh god. annie, i kissed annie. i kissed annie.",Ses03M
Ses03M_script01_3_M021,hap,we're going to live now. i'm going to make you so happy.,Ses03M
Ses03M_script01_3_M023,sad,"nothing. hey, let's drive somewhere. i want to be alone with you.",Ses03M
Ses03M_script01_3_M027,sad,you remember overseas i was in command of a company?,Ses03M
Ses03M_script01_3_M028,sad,well i lost them.,Ses03M
Ses03M_script01_3_M029,sad,just about all.,Ses03M
Ses03M_script01_3_M030,sad,takes a little while to toss that off cause they weren't just men.,Ses03M
Ses03M_script01_3_M031,sad,"for instance, one time this...it had been raining several days and this one kid, he came up to me, he gave me his last pair of dry socks, put them in my pocket.",Ses03M
Ses03M_script01_3_M032,sad,"that's just a little thing but that's the kind of guys i had. they didn't just die, they killed themselves for each other and i mean that exactly.",Ses03M
Ses03M_script01_3_M033,sad,a little more selfish and they'd still be here today. and i got this idea watching them go down. see everything was being destroyed but there was one new thing that was being created.,Ses03M
Ses03M_script01_3_M034,sad,"it was a kind of responsibility, man for man. you understand me?",Ses03M
Ses03M_script01_3_M035,sad,and to show that and to bring that onto the earth again like some sort of monument standing right behind all of us and we could feel it and it would make a difference to him.,Ses03M
Ses03M_script01_3_M036,sad,and then i came here and it was incredible. there was no meaning in it here. the whole thing to them was a kind of bus accident.,Ses03M
Ses03M_script01_3_M037,sad,"and i went to work with dad and that rat race again and i felt what you said, ashamed. somehow because nobody was changed at all.",Ses03M
Ses03M_script01_3_M038,sad,"it seemed to make a sucker out of a lot of guys. i felt wrong to be alive. i felt wrong to have that new checkbook,",Ses03M
Ses03M_script01_3_M039,sad,"open that new bank account, drive the new car and see the new refrigerator",Ses03M
Ses03M_script01_3_M040,sad,"cause you can take those things out of the war. but you got to know, when you drive that car that it came out of the love that a man can have for a man and you got to be a little bit better because of that.",Ses03M
